17:02:33.344036 IP bpc036.isi.deterlab.net.59496 > bpc063.isi.deterlab.net.http: tcp 0
17:02:33.344280 IP bpc063.isi.deterlab.net.http > bpc036.isi.deterlab.net.59496: tcp 0
17:02:34.372202 IP bpc036.isi.deterlab.net.59498 > bpc063.isi.deterlab.net.http: tcp 0
17:02:34.372514 IP bpc063.isi.deterlab.net.http > bpc036.isi.deterlab.net.59498: tcp 0
17:02:35.401748 IP bpc036.isi.deterlab.net.59500 > bpc063.isi.deterlab.net.http: tcp 0
17:02:35.401948 IP bpc063.isi.deterlab.net.http > bpc036.isi.deterlab.net.59500: tcp 0
17:02:36.431398 IP bpc036.isi.deterlab.net.59502 > bpc063.isi.deterlab.net.http: tcp 0
17:02:36.431731 IP bpc063.isi.deterlab.net.http > bpc036.isi.deterlab.net.59502: tcp 0
17:02:37.461011 IP bpc036.isi.deterlab.net.59504 > bpc063.isi.deterlab.net.http: tcp 0
17:02:37.461213 IP bpc063.isi.deterlab.net.http > bpc036.isi.deterlab.net.59504: tcp 0
17:02:38.490261 IP bpc036.isi.deterlab.net.59506 > bpc063.isi.deterlab.net.http: tcp 0
17:02:38.490593 IP bpc063.isi.deterlab.net.http > bpc036.isi.deterlab.net.59506: tcp 0
17:02:39.519780 IP bpc036.isi.deterlab.net.59508 > bpc063.isi.deterlab.net.http: tcp 0
17:02:39.520026 IP bpc063.isi.deterlab.net.http > bpc036.isi.deterlab.net.59508: tcp 0
17:02:40.549303 IP bpc036.isi.deterlab.net.59510 > bpc063.isi.deterlab.net.http: tcp 0
17:02:40.549557 IP bpc063.isi.deterlab.net.http > bpc036.isi.deterlab.net.59510: tcp 0
17:02:41.581353 IP bpc036.isi.deterlab.net.59512 > bpc063.isi.deterlab.net.http: tcp 0
17:02:41.581540 IP bpc063.isi.deterlab.net.http > bpc036.isi.deterlab.net.59512: tcp 0
17:02:42.609533 IP bpc036.isi.deterlab.net.59514 > bpc063.isi.deterlab.net.http: tcp 0
17:02:42.609820 IP bpc063.isi.deterlab.net.http > bpc036.isi.deterlab.net.59514: tcp 0
17:02:43.637642 IP bpc036.isi.deterlab.net.59516 > bpc063.isi.deterlab.net.http: tcp 0
17:02:43.637905 IP bpc063.isi.deterlab.net.http > bpc036.isi.deterlab.net.59516: tcp 0
17:02:44.665957 IP bpc036.isi.deterlab.net.59518 > bpc063.isi.deterlab.net.http: tcp 0
17:02:44.666192 IP bpc063.isi.deterlab.net.http > bpc036.isi.deterlab.net.59518: tcp 0
17:02:45.694241 IP bpc036.isi.deterlab.net.59520 > bpc063.isi.deterlab.net.http: tcp 0
17:02:45.694523 IP bpc063.isi.deterlab.net.http > bpc036.isi.deterlab.net.59520: tcp 0
17:02:46.740262 IP bpc036.isi.deterlab.net.59522 > bpc063.isi.deterlab.net.http: tcp 0
17:02:46.740630 IP bpc063.isi.deterlab.net.http > bpc036.isi.deterlab.net.59522: tcp 0
17:02:47.769340 IP bpc036.isi.deterlab.net.59524 > bpc063.isi.deterlab.net.http: tcp 0
17:02:47.769613 IP bpc063.isi.deterlab.net.http > bpc036.isi.deterlab.net.59524: tcp 0
17:02:48.800553 IP bpc036.isi.deterlab.net.59526 > bpc063.isi.deterlab.net.http: tcp 0
17:02:48.800917 IP bpc063.isi.deterlab.net.http > bpc036.isi.deterlab.net.59526: tcp 0
17:02:49.829365 IP bpc036.isi.deterlab.net.59528 > bpc063.isi.deterlab.net.http: tcp 0
17:02:49.829726 IP bpc063.isi.deterlab.net.http > bpc036.isi.deterlab.net.59528: tcp 0
17:02:50.858150 IP bpc036.isi.deterlab.net.59530 > bpc063.isi.deterlab.net.http: tcp 0
17:02:50.858559 IP bpc063.isi.deterlab.net.http > bpc036.isi.deterlab.net.59530: tcp 0
17:02:51.887165 IP bpc036.isi.deterlab.net.59532 > bpc063.isi.deterlab.net.http: tcp 0
17:02:51.887492 IP bpc063.isi.deterlab.net.http > bpc036.isi.deterlab.net.59532: tcp 0
17:02:52.916158 IP bpc036.isi.deterlab.net.59534 > bpc063.isi.deterlab.net.http: tcp 0
17:02:52.916525 IP bpc063.isi.deterlab.net.http > bpc036.isi.deterlab.net.59534: tcp 0
17:02:53.944902 IP bpc036.isi.deterlab.net.59536 > bpc063.isi.deterlab.net.http: tcp 0
17:02:53.945259 IP bpc063.isi.deterlab.net.http > bpc036.isi.deterlab.net.59536: tcp 0
17:02:54.973610 IP bpc036.isi.deterlab.net.59538 > bpc063.isi.deterlab.net.http: tcp 0
17:02:54.973743 IP bpc063.isi.deterlab.net.http > bpc036.isi.deterlab.net.59538: tcp 0
17:02:56.002642 IP bpc036.isi.deterlab.net.59540 > bpc063.isi.deterlab.net.http: tcp 0
17:02:56.002825 IP bpc063.isi.deterlab.net.http > bpc036.isi.deterlab.net.59540: tcp 0
17:02:57.031618 IP bpc036.isi.deterlab.net.59542 > bpc063.isi.deterlab.net.http: tcp 0
17:02:57.031759 IP bpc063.isi.deterlab.net.http > bpc036.isi.deterlab.net.59542: tcp 0
17:02:58.060668 IP bpc036.isi.deterlab.net.59544 > bpc063.isi.deterlab.net.http: tcp 0
17:02:58.061042 IP bpc063.isi.deterlab.net.http > bpc036.isi.deterlab.net.59544: tcp 0
17:02:59.089551 IP bpc036.isi.deterlab.net.59546 > bpc063.isi.deterlab.net.http: tcp 0
17:02:59.089675 IP bpc063.isi.deterlab.net.http > bpc036.isi.deterlab.net.59546: tcp 0
17:03:00.133636 IP bpc036.isi.deterlab.net.59548 > bpc063.isi.deterlab.net.http: tcp 0
17:03:00.133784 IP bpc063.isi.deterlab.net.http > bpc036.isi.deterlab.net.59548: tcp 0
17:03:01.163591 IP bpc036.isi.deterlab.net.59550 > bpc063.isi.deterlab.net.http: tcp 0
17:03:01.163867 IP bpc063.isi.deterlab.net.http > bpc036.isi.deterlab.net.59550: tcp 0
17:03:02.194486 IP bpc036.isi.deterlab.net.59552 > bpc063.isi.deterlab.net.http: tcp 0
17:03:02.194670 IP bpc063.isi.deterlab.net.http > bpc036.isi.deterlab.net.59552: tcp 0
17:03:03.226985 IP bpc036.isi.deterlab.net.59554 > bpc063.isi.deterlab.net.http: tcp 0
17:03:03.227247 IP bpc063.isi.deterlab.net.http > bpc036.isi.deterlab.net.59554: tcp 0
17:03:04.257596 IP bpc036.isi.deterlab.net.59556 > bpc063.isi.deterlab.net.http: tcp 0
17:03:04.257828 IP bpc063.isi.deterlab.net.http > bpc036.isi.deterlab.net.59556: tcp 0
17:03:05.287981 IP bpc036.isi.deterlab.net.59558 > bpc063.isi.deterlab.net.http: tcp 0
17:03:05.288260 IP bpc063.isi.deterlab.net.http > bpc036.isi.deterlab.net.59558: tcp 0
17:03:06.318576 IP bpc036.isi.deterlab.net.59560 > bpc063.isi.deterlab.net.http: tcp 0
17:03:06.318791 IP bpc063.isi.deterlab.net.http > bpc036.isi.deterlab.net.59560: tcp 0
17:03:07.349894 IP bpc036.isi.deterlab.net.59562 > bpc063.isi.deterlab.net.http: tcp 0
17:03:07.350090 IP bpc063.isi.deterlab.net.http > bpc036.isi.deterlab.net.59562: tcp 0
17:03:08.380164 IP bpc036.isi.deterlab.net.59564 > bpc063.isi.deterlab.net.http: tcp 0
17:03:08.380321 IP bpc063.isi.deterlab.net.http > bpc036.isi.deterlab.net.59564: tcp 0
17:03:09.409274 IP bpc036.isi.deterlab.net.59566 > bpc063.isi.deterlab.net.http: tcp 0
17:03:09.409654 IP bpc063.isi.deterlab.net.http > bpc036.isi.deterlab.net.59566: tcp 0
17:03:10.439161 IP bpc036.isi.deterlab.net.59568 > bpc063.isi.deterlab.net.http: tcp 0
17:03:10.439477 IP bpc063.isi.deterlab.net.http > bpc036.isi.deterlab.net.59568: tcp 0
17:03:11.470622 IP bpc036.isi.deterlab.net.59570 > bpc063.isi.deterlab.net.http: tcp 0
17:03:11.470805 IP bpc063.isi.deterlab.net.http > bpc036.isi.deterlab.net.59570: tcp 0
17:03:12.499356 IP bpc036.isi.deterlab.net.59572 > bpc063.isi.deterlab.net.http: tcp 0
17:03:12.499489 IP bpc063.isi.deterlab.net.http > bpc036.isi.deterlab.net.59572: tcp 0
17:03:13.528089 IP bpc036.isi.deterlab.net.59574 > bpc063.isi.deterlab.net.http: tcp 0
17:03:13.528223 IP bpc063.isi.deterlab.net.http > bpc036.isi.deterlab.net.59574: tcp 0
17:03:14.556695 IP bpc036.isi.deterlab.net.59576 > bpc063.isi.deterlab.net.http: tcp 0
17:03:14.556877 IP bpc063.isi.deterlab.net.http > bpc036.isi.deterlab.net.59576: tcp 0
17:03:15.585333 IP bpc036.isi.deterlab.net.59578 > bpc063.isi.deterlab.net.http: tcp 0
17:03:15.585491 IP bpc063.isi.deterlab.net.http > bpc036.isi.deterlab.net.59578: tcp 0
17:03:16.616370 IP bpc036.isi.deterlab.net.59580 > bpc063.isi.deterlab.net.http: tcp 0
17:03:16.616572 IP bpc063.isi.deterlab.net.http > bpc036.isi.deterlab.net.59580: tcp 0
17:03:17.646041 IP bpc036.isi.deterlab.net.59582 > bpc063.isi.deterlab.net.http: tcp 0
17:03:17.646394 IP bpc063.isi.deterlab.net.http > bpc036.isi.deterlab.net.59582: tcp 0
17:03:18.675190 IP bpc036.isi.deterlab.net.59584 > bpc063.isi.deterlab.net.http: tcp 0
17:03:18.675527 IP bpc063.isi.deterlab.net.http > bpc036.isi.deterlab.net.59584: tcp 0
17:03:19.703801 IP bpc036.isi.deterlab.net.59586 > bpc063.isi.deterlab.net.http: tcp 0
17:03:19.703961 IP bpc063.isi.deterlab.net.http > bpc036.isi.deterlab.net.59586: tcp 0
17:03:20.733128 IP bpc036.isi.deterlab.net.59588 > bpc063.isi.deterlab.net.http: tcp 0
17:03:20.733395 IP bpc063.isi.deterlab.net.http > bpc036.isi.deterlab.net.59588: tcp 0
17:03:21.765201 IP bpc036.isi.deterlab.net.59590 > bpc063.isi.deterlab.net.http: tcp 0
17:03:21.765431 IP bpc063.isi.deterlab.net.http > bpc036.isi.deterlab.net.59590: tcp 0
17:03:22.796299 IP bpc036.isi.deterlab.net.59592 > bpc063.isi.deterlab.net.http: tcp 0
17:03:22.796461 IP bpc063.isi.deterlab.net.http > bpc036.isi.deterlab.net.59592: tcp 0
17:03:23.828154 IP bpc036.isi.deterlab.net.59594 > bpc063.isi.deterlab.net.http: tcp 0
17:03:23.828389 IP bpc063.isi.deterlab.net.http > bpc036.isi.deterlab.net.59594: tcp 0
17:03:24.857340 IP bpc036.isi.deterlab.net.59596 > bpc063.isi.deterlab.net.http: tcp 0
17:03:24.857574 IP bpc063.isi.deterlab.net.http > bpc036.isi.deterlab.net.59596: tcp 0
17:03:25.887330 IP bpc036.isi.deterlab.net.59598 > bpc063.isi.deterlab.net.http: tcp 0
17:03:25.887555 IP bpc063.isi.deterlab.net.http > bpc036.isi.deterlab.net.59598: tcp 0
17:03:26.916255 IP bpc036.isi.deterlab.net.59600 > bpc063.isi.deterlab.net.http: tcp 0
17:03:26.916588 IP bpc063.isi.deterlab.net.http > bpc036.isi.deterlab.net.59600: tcp 0
17:03:27.945453 IP bpc036.isi.deterlab.net.59602 > bpc063.isi.deterlab.net.http: tcp 0
17:03:27.945771 IP bpc063.isi.deterlab.net.http > bpc036.isi.deterlab.net.59602: tcp 0
17:03:28.975887 IP bpc036.isi.deterlab.net.59604 > bpc063.isi.deterlab.net.http: tcp 0
17:03:28.976155 IP bpc063.isi.deterlab.net.http > bpc036.isi.deterlab.net.59604: tcp 0
17:03:30.004559 IP bpc036.isi.deterlab.net.59606 > bpc063.isi.deterlab.net.http: tcp 0
17:03:30.004690 IP bpc063.isi.deterlab.net.http > bpc036.isi.deterlab.net.59606: tcp 0
17:03:31.033252 IP bpc036.isi.deterlab.net.59608 > bpc063.isi.deterlab.net.http: tcp 0
17:03:31.033624 IP bpc063.isi.deterlab.net.http > bpc036.isi.deterlab.net.59608: tcp 0
17:03:32.062099 IP bpc036.isi.deterlab.net.59610 > bpc063.isi.deterlab.net.http: tcp 0
17:03:32.062256 IP bpc063.isi.deterlab.net.http > bpc036.isi.deterlab.net.59610: tcp 0
17:03:33.091062 IP bpc036.isi.deterlab.net.59612 > bpc063.isi.deterlab.net.http: tcp 0
17:03:33.091390 IP bpc063.isi.deterlab.net.http > bpc036.isi.deterlab.net.59612: tcp 0
17:03:34.119762 IP bpc036.isi.deterlab.net.59614 > bpc063.isi.deterlab.net.http: tcp 0
17:03:34.120124 IP bpc063.isi.deterlab.net.http > bpc036.isi.deterlab.net.59614: tcp 0
17:03:35.148723 IP bpc036.isi.deterlab.net.59616 > bpc063.isi.deterlab.net.http: tcp 0
17:03:35.148885 IP bpc063.isi.deterlab.net.http > bpc036.isi.deterlab.net.59616: tcp 0
17:03:36.177674 IP bpc036.isi.deterlab.net.59618 > bpc063.isi.deterlab.net.http: tcp 0
17:03:36.177991 IP bpc063.isi.deterlab.net.http > bpc036.isi.deterlab.net.59618: tcp 0
17:03:37.207232 IP bpc036.isi.deterlab.net.59620 > bpc063.isi.deterlab.net.http: tcp 0
17:03:37.207580 IP bpc063.isi.deterlab.net.http > bpc036.isi.deterlab.net.59620: tcp 0
17:03:38.237841 IP bpc036.isi.deterlab.net.59622 > bpc063.isi.deterlab.net.http: tcp 0
17:03:38.237961 IP bpc063.isi.deterlab.net.http > bpc036.isi.deterlab.net.59622: tcp 0
17:03:39.266835 IP bpc036.isi.deterlab.net.59624 > bpc063.isi.deterlab.net.http: tcp 0
17:03:39.266994 IP bpc063.isi.deterlab.net.http > bpc036.isi.deterlab.net.59624: tcp 0
17:03:40.295778 IP bpc036.isi.deterlab.net.59626 > bpc063.isi.deterlab.net.http: tcp 0
17:03:40.301032 IP bpc063.isi.deterlab.net.http > bpc036.isi.deterlab.net.59626: tcp 0
17:03:41.324530 IP bpc036.isi.deterlab.net.59628 > bpc063.isi.deterlab.net.http: tcp 0
17:03:41.324712 IP bpc063.isi.deterlab.net.http > bpc036.isi.deterlab.net.59628: tcp 0
17:03:42.353489 IP bpc036.isi.deterlab.net.59630 > bpc063.isi.deterlab.net.http: tcp 0
17:03:42.353645 IP bpc063.isi.deterlab.net.http > bpc036.isi.deterlab.net.59630: tcp 0
17:03:43.382294 IP bpc036.isi.deterlab.net.59632 > bpc063.isi.deterlab.net.http: tcp 0
17:03:43.382479 IP bpc063.isi.deterlab.net.http > bpc036.isi.deterlab.net.59632: tcp 0
17:03:44.412828 IP bpc036.isi.deterlab.net.59634 > bpc063.isi.deterlab.net.http: tcp 0
17:03:44.413012 IP bpc063.isi.deterlab.net.http > bpc036.isi.deterlab.net.59634: tcp 0
17:03:45.441913 IP bpc036.isi.deterlab.net.59636 > bpc063.isi.deterlab.net.http: tcp 0
17:03:45.442145 IP bpc063.isi.deterlab.net.http > bpc036.isi.deterlab.net.59636: tcp 0
17:03:46.470456 IP bpc036.isi.deterlab.net.59638 > bpc063.isi.deterlab.net.http: tcp 0
17:03:46.470627 IP bpc063.isi.deterlab.net.http > bpc036.isi.deterlab.net.59638: tcp 0
17:03:47.515076 IP bpc036.isi.deterlab.net.59640 > bpc063.isi.deterlab.net.http: tcp 0
17:03:47.515337 IP bpc063.isi.deterlab.net.http > bpc036.isi.deterlab.net.59640: tcp 0
17:03:48.543506 IP bpc036.isi.deterlab.net.59642 > bpc063.isi.deterlab.net.http: tcp 0
17:03:48.543672 IP bpc063.isi.deterlab.net.http > bpc036.isi.deterlab.net.59642: tcp 0
17:03:49.589116 IP bpc036.isi.deterlab.net.59644 > bpc063.isi.deterlab.net.http: tcp 0
17:03:49.589378 IP bpc063.isi.deterlab.net.http > bpc036.isi.deterlab.net.59644: tcp 0
17:03:50.635110 IP bpc036.isi.deterlab.net.59646 > bpc063.isi.deterlab.net.http: tcp 0
17:03:50.635284 IP bpc063.isi.deterlab.net.http > bpc036.isi.deterlab.net.59646: tcp 0
17:03:51.664454 IP bpc036.isi.deterlab.net.59648 > bpc063.isi.deterlab.net.http: tcp 0
17:03:51.664667 IP bpc063.isi.deterlab.net.http > bpc036.isi.deterlab.net.59648: tcp 0
17:03:52.693253 IP bpc036.isi.deterlab.net.59650 > bpc063.isi.deterlab.net.http: tcp 0
17:03:52.693399 IP bpc063.isi.deterlab.net.http > bpc036.isi.deterlab.net.59650: tcp 0
17:03:53.722843 IP bpc036.isi.deterlab.net.59652 > bpc063.isi.deterlab.net.http: tcp 0
17:03:53.723183 IP bpc063.isi.deterlab.net.http > bpc036.isi.deterlab.net.59652: tcp 0
17:03:54.753537 IP bpc036.isi.deterlab.net.59654 > bpc063.isi.deterlab.net.http: tcp 0
17:03:54.753815 IP bpc063.isi.deterlab.net.http > bpc036.isi.deterlab.net.59654: tcp 0
17:03:55.782561 IP bpc036.isi.deterlab.net.59656 > bpc063.isi.deterlab.net.http: tcp 0
17:03:55.782799 IP bpc063.isi.deterlab.net.http > bpc036.isi.deterlab.net.59656: tcp 0
17:03:56.813686 IP bpc036.isi.deterlab.net.59658 > bpc063.isi.deterlab.net.http: tcp 0
17:03:56.813880 IP bpc063.isi.deterlab.net.http > bpc036.isi.deterlab.net.59658: tcp 0
17:03:57.842222 IP bpc036.isi.deterlab.net.59660 > bpc063.isi.deterlab.net.http: tcp 0
17:03:57.842414 IP bpc063.isi.deterlab.net.http > bpc036.isi.deterlab.net.59660: tcp 0
17:03:58.872368 IP bpc036.isi.deterlab.net.59662 > bpc063.isi.deterlab.net.http: tcp 0
17:03:58.872594 IP bpc063.isi.deterlab.net.http > bpc036.isi.deterlab.net.59662: tcp 0
17:03:59.902542 IP bpc036.isi.deterlab.net.59664 > bpc063.isi.deterlab.net.http: tcp 0
17:03:59.902826 IP bpc063.isi.deterlab.net.http > bpc036.isi.deterlab.net.59664: tcp 0
17:04:00.944949 IP bpc036.isi.deterlab.net.59666 > bpc063.isi.deterlab.net.http: tcp 0
17:04:00.945301 IP bpc063.isi.deterlab.net.http > bpc036.isi.deterlab.net.59666: tcp 0
17:04:01.976100 IP bpc036.isi.deterlab.net.59668 > bpc063.isi.deterlab.net.http: tcp 0
17:04:01.976280 IP bpc063.isi.deterlab.net.http > bpc036.isi.deterlab.net.59668: tcp 0
17:04:03.020945 IP bpc036.isi.deterlab.net.59670 > bpc063.isi.deterlab.net.http: tcp 0
17:04:03.021290 IP bpc063.isi.deterlab.net.http > bpc036.isi.deterlab.net.59670: tcp 0
17:04:04.050044 IP bpc036.isi.deterlab.net.59672 > bpc063.isi.deterlab.net.http: tcp 0
17:04:04.050223 IP bpc063.isi.deterlab.net.http > bpc036.isi.deterlab.net.59672: tcp 0
17:04:05.078639 IP bpc036.isi.deterlab.net.59674 > bpc063.isi.deterlab.net.http: tcp 0
17:04:05.078755 IP bpc063.isi.deterlab.net.http > bpc036.isi.deterlab.net.59674: tcp 0
17:04:06.123607 IP bpc036.isi.deterlab.net.59676 > bpc063.isi.deterlab.net.http: tcp 0
17:04:06.123965 IP bpc063.isi.deterlab.net.http > bpc036.isi.deterlab.net.59676: tcp 0
17:04:07.152907 IP bpc036.isi.deterlab.net.59678 > bpc063.isi.deterlab.net.http: tcp 0
17:04:07.153199 IP bpc063.isi.deterlab.net.http > bpc036.isi.deterlab.net.59678: tcp 0
17:04:08.183258 IP bpc036.isi.deterlab.net.59680 > bpc063.isi.deterlab.net.http: tcp 0
17:04:08.183560 IP bpc063.isi.deterlab.net.http > bpc036.isi.deterlab.net.59680: tcp 0
17:04:09.211949 IP bpc036.isi.deterlab.net.59682 > bpc063.isi.deterlab.net.http: tcp 0
17:04:09.212093 IP bpc063.isi.deterlab.net.http > bpc036.isi.deterlab.net.59682: tcp 0
17:04:10.241019 IP bpc036.isi.deterlab.net.59684 > bpc063.isi.deterlab.net.http: tcp 0
17:04:10.241377 IP bpc063.isi.deterlab.net.http > bpc036.isi.deterlab.net.59684: tcp 0
17:04:11.269726 IP bpc036.isi.deterlab.net.59686 > bpc063.isi.deterlab.net.http: tcp 0
17:04:11.269862 IP bpc063.isi.deterlab.net.http > bpc036.isi.deterlab.net.59686: tcp 0
17:04:12.315007 IP bpc036.isi.deterlab.net.59688 > bpc063.isi.deterlab.net.http: tcp 0
17:04:12.315197 IP bpc063.isi.deterlab.net.http > bpc036.isi.deterlab.net.59688: tcp 0
17:04:13.343867 IP bpc036.isi.deterlab.net.59690 > bpc063.isi.deterlab.net.http: tcp 0
17:04:13.344051 IP bpc063.isi.deterlab.net.http > bpc036.isi.deterlab.net.59690: tcp 0
17:04:14.373472 IP bpc036.isi.deterlab.net.59692 > bpc063.isi.deterlab.net.http: tcp 0
17:04:14.373784 IP bpc063.isi.deterlab.net.http > bpc036.isi.deterlab.net.59692: tcp 0
17:04:15.402153 IP bpc036.isi.deterlab.net.59694 > bpc063.isi.deterlab.net.http: tcp 0
17:04:15.402416 IP bpc063.isi.deterlab.net.http > bpc036.isi.deterlab.net.59694: tcp 0
17:04:16.431507 IP bpc036.isi.deterlab.net.59696 > bpc063.isi.deterlab.net.http: tcp 0
17:04:16.431650 IP bpc063.isi.deterlab.net.http > bpc036.isi.deterlab.net.59696: tcp 0
17:04:17.461544 IP bpc036.isi.deterlab.net.59698 > bpc063.isi.deterlab.net.http: tcp 0
17:04:17.461919 IP bpc063.isi.deterlab.net.http > bpc036.isi.deterlab.net.59698: tcp 0
17:04:18.491782 IP bpc036.isi.deterlab.net.59700 > bpc063.isi.deterlab.net.http: tcp 0
17:04:18.492054 IP bpc063.isi.deterlab.net.http > bpc036.isi.deterlab.net.59700: tcp 0
17:04:19.521431 IP bpc036.isi.deterlab.net.59702 > bpc063.isi.deterlab.net.http: tcp 0
17:04:19.521740 IP bpc063.isi.deterlab.net.http > bpc036.isi.deterlab.net.59702: tcp 0
17:04:20.552729 IP bpc036.isi.deterlab.net.59704 > bpc063.isi.deterlab.net.http: tcp 0
17:04:20.552918 IP bpc063.isi.deterlab.net.http > bpc036.isi.deterlab.net.59704: tcp 0
17:04:21.581631 IP bpc036.isi.deterlab.net.59706 > bpc063.isi.deterlab.net.http: tcp 0
17:04:21.581801 IP bpc063.isi.deterlab.net.http > bpc036.isi.deterlab.net.59706: tcp 0
17:04:22.610993 IP bpc036.isi.deterlab.net.59708 > bpc063.isi.deterlab.net.http: tcp 0
17:04:22.611235 IP bpc063.isi.deterlab.net.http > bpc036.isi.deterlab.net.59708: tcp 0
17:04:23.640410 IP bpc036.isi.deterlab.net.59710 > bpc063.isi.deterlab.net.http: tcp 0
17:04:23.640719 IP bpc063.isi.deterlab.net.http > bpc036.isi.deterlab.net.59710: tcp 0
17:04:24.670063 IP bpc036.isi.deterlab.net.59712 > bpc063.isi.deterlab.net.http: tcp 0
17:04:24.670402 IP bpc063.isi.deterlab.net.http > bpc036.isi.deterlab.net.59712: tcp 0
17:04:25.698464 IP bpc036.isi.deterlab.net.59714 > bpc063.isi.deterlab.net.http: tcp 0
17:04:25.698585 IP bpc063.isi.deterlab.net.http > bpc036.isi.deterlab.net.59714: tcp 0
17:04:26.743613 IP bpc036.isi.deterlab.net.59716 > bpc063.isi.deterlab.net.http: tcp 0
17:04:26.743993 IP bpc063.isi.deterlab.net.http > bpc036.isi.deterlab.net.59716: tcp 0
17:04:27.774051 IP bpc036.isi.deterlab.net.59718 > bpc063.isi.deterlab.net.http: tcp 0
17:04:27.774426 IP bpc063.isi.deterlab.net.http > bpc036.isi.deterlab.net.59718: tcp 0
17:04:28.802419 IP bpc036.isi.deterlab.net.59720 > bpc063.isi.deterlab.net.http: tcp 0
17:04:28.802760 IP bpc063.isi.deterlab.net.http > bpc036.isi.deterlab.net.59720: tcp 0
17:04:29.830855 IP bpc036.isi.deterlab.net.59722 > bpc063.isi.deterlab.net.http: tcp 0
17:04:29.831245 IP bpc063.isi.deterlab.net.http > bpc036.isi.deterlab.net.59722: tcp 0
17:04:30.875998 IP bpc036.isi.deterlab.net.59724 > bpc063.isi.deterlab.net.http: tcp 0
17:04:30.876153 IP bpc063.isi.deterlab.net.http > bpc036.isi.deterlab.net.59724: tcp 0
17:04:31.906680 IP bpc036.isi.deterlab.net.59726 > bpc063.isi.deterlab.net.http: tcp 0
17:04:31.906934 IP bpc063.isi.deterlab.net.http > bpc036.isi.deterlab.net.59726: tcp 0
17:04:32.951413 IP bpc036.isi.deterlab.net.59728 > bpc063.isi.deterlab.net.http: tcp 0
17:04:32.951692 IP bpc063.isi.deterlab.net.http > bpc036.isi.deterlab.net.59728: tcp 0
17:04:33.980313 IP bpc036.isi.deterlab.net.59730 > bpc063.isi.deterlab.net.http: tcp 0
17:04:33.980576 IP bpc063.isi.deterlab.net.http > bpc036.isi.deterlab.net.59730: tcp 0
17:04:35.025167 IP bpc036.isi.deterlab.net.59732 > bpc063.isi.deterlab.net.http: tcp 0
17:04:35.025584 IP bpc063.isi.deterlab.net.http > bpc036.isi.deterlab.net.59732: tcp 0
17:04:36.054753 IP bpc036.isi.deterlab.net.59734 > bpc063.isi.deterlab.net.http: tcp 0
17:04:36.055118 IP bpc063.isi.deterlab.net.http > bpc036.isi.deterlab.net.59734: tcp 0
17:04:37.084966 IP bpc036.isi.deterlab.net.59736 > bpc063.isi.deterlab.net.http: tcp 0
17:04:37.085099 IP bpc063.isi.deterlab.net.http > bpc036.isi.deterlab.net.59736: tcp 0
17:04:38.113600 IP bpc036.isi.deterlab.net.59738 > bpc063.isi.deterlab.net.http: tcp 0
17:04:38.113984 IP bpc063.isi.deterlab.net.http > bpc036.isi.deterlab.net.59738: tcp 0
17:04:39.143332 IP bpc036.isi.deterlab.net.59740 > bpc063.isi.deterlab.net.http: tcp 0
17:04:39.143567 IP bpc063.isi.deterlab.net.http > bpc036.isi.deterlab.net.59740: tcp 0
17:04:40.188837 IP bpc036.isi.deterlab.net.59742 > bpc063.isi.deterlab.net.http: tcp 0
17:04:40.189074 IP bpc063.isi.deterlab.net.http > bpc036.isi.deterlab.net.59742: tcp 0
17:04:41.218569 IP bpc036.isi.deterlab.net.59744 > bpc063.isi.deterlab.net.http: tcp 0
17:04:41.218810 IP bpc063.isi.deterlab.net.http > bpc036.isi.deterlab.net.59744: tcp 0
17:04:42.247645 IP bpc036.isi.deterlab.net.59746 > bpc063.isi.deterlab.net.http: tcp 0
17:04:42.247995 IP bpc063.isi.deterlab.net.http > bpc036.isi.deterlab.net.59746: tcp 0
17:04:43.275972 IP bpc036.isi.deterlab.net.59748 > bpc063.isi.deterlab.net.http: tcp 0
17:04:43.276150 IP bpc063.isi.deterlab.net.http > bpc036.isi.deterlab.net.59748: tcp 0
17:04:44.320468 IP bpc036.isi.deterlab.net.59750 > bpc063.isi.deterlab.net.http: tcp 0
17:04:44.320708 IP bpc063.isi.deterlab.net.http > bpc036.isi.deterlab.net.59750: tcp 0
17:04:45.348724 IP bpc036.isi.deterlab.net.59752 > bpc063.isi.deterlab.net.http: tcp 0
17:04:45.348995 IP bpc063.isi.deterlab.net.http > bpc036.isi.deterlab.net.59752: tcp 0
17:04:46.377699 IP bpc036.isi.deterlab.net.59754 > bpc063.isi.deterlab.net.http: tcp 0
17:04:46.378028 IP bpc063.isi.deterlab.net.http > bpc036.isi.deterlab.net.59754: tcp 0
17:04:47.409238 IP bpc036.isi.deterlab.net.59756 > bpc063.isi.deterlab.net.http: tcp 0
17:04:47.409746 IP bpc063.isi.deterlab.net.http > bpc036.isi.deterlab.net.59756: tcp 0
17:04:48.438433 IP bpc036.isi.deterlab.net.59758 > bpc063.isi.deterlab.net.http: tcp 0
17:04:48.438761 IP bpc063.isi.deterlab.net.http > bpc036.isi.deterlab.net.59758: tcp 0
17:04:49.467177 IP bpc036.isi.deterlab.net.59760 > bpc063.isi.deterlab.net.http: tcp 0
17:04:49.467345 IP bpc063.isi.deterlab.net.http > bpc036.isi.deterlab.net.59760: tcp 0
17:04:50.497076 IP bpc036.isi.deterlab.net.59762 > bpc063.isi.deterlab.net.http: tcp 0
17:04:50.497379 IP bpc063.isi.deterlab.net.http > bpc036.isi.deterlab.net.59762: tcp 0
17:04:51.527436 IP bpc036.isi.deterlab.net.59764 > bpc063.isi.deterlab.net.http: tcp 0
17:04:51.527761 IP bpc063.isi.deterlab.net.http > bpc036.isi.deterlab.net.59764: tcp 0
17:04:52.559240 IP bpc036.isi.deterlab.net.59766 > bpc063.isi.deterlab.net.http: tcp 0
17:04:52.559488 IP bpc063.isi.deterlab.net.http > bpc036.isi.deterlab.net.59766: tcp 0
17:04:53.603655 IP bpc036.isi.deterlab.net.59768 > bpc063.isi.deterlab.net.http: tcp 0
17:04:53.603896 IP bpc063.isi.deterlab.net.http > bpc036.isi.deterlab.net.59768: tcp 0
17:04:54.648008 IP bpc036.isi.deterlab.net.59770 > bpc063.isi.deterlab.net.http: tcp 0
17:04:54.648254 IP bpc063.isi.deterlab.net.http > bpc036.isi.deterlab.net.59770: tcp 0
17:04:55.676217 IP bpc036.isi.deterlab.net.59772 > bpc063.isi.deterlab.net.http: tcp 0
17:04:55.676540 IP bpc063.isi.deterlab.net.http > bpc036.isi.deterlab.net.59772: tcp 0
17:04:56.704420 IP bpc036.isi.deterlab.net.59774 > bpc063.isi.deterlab.net.http: tcp 0
17:04:56.704626 IP bpc063.isi.deterlab.net.http > bpc036.isi.deterlab.net.59774: tcp 0
17:04:57.732775 IP bpc036.isi.deterlab.net.59776 > bpc063.isi.deterlab.net.http: tcp 0
17:04:57.732911 IP bpc063.isi.deterlab.net.http > bpc036.isi.deterlab.net.59776: tcp 0
17:04:58.762331 IP bpc036.isi.deterlab.net.59778 > bpc063.isi.deterlab.net.http: tcp 0
17:04:58.762546 IP bpc063.isi.deterlab.net.http > bpc036.isi.deterlab.net.59778: tcp 0
17:04:59.790466 IP bpc036.isi.deterlab.net.59780 > bpc063.isi.deterlab.net.http: tcp 0
17:04:59.790779 IP bpc063.isi.deterlab.net.http > bpc036.isi.deterlab.net.59780: tcp 0
17:05:00.835981 IP bpc036.isi.deterlab.net.59782 > bpc063.isi.deterlab.net.http: tcp 0
17:05:00.836288 IP bpc063.isi.deterlab.net.http > bpc036.isi.deterlab.net.59782: tcp 0
17:05:01.878690 IP bpc036.isi.deterlab.net.59784 > bpc063.isi.deterlab.net.http: tcp 0
17:05:01.878800 IP bpc063.isi.deterlab.net.http > bpc036.isi.deterlab.net.59784: tcp 0
17:05:02.907824 IP bpc036.isi.deterlab.net.59786 > bpc063.isi.deterlab.net.http: tcp 0
17:05:02.908035 IP bpc063.isi.deterlab.net.http > bpc036.isi.deterlab.net.59786: tcp 0
17:05:03.936200 IP bpc036.isi.deterlab.net.59788 > bpc063.isi.deterlab.net.http: tcp 0
17:05:03.936517 IP bpc063.isi.deterlab.net.http > bpc036.isi.deterlab.net.59788: tcp 0
17:05:04.980458 IP bpc036.isi.deterlab.net.59790 > bpc063.isi.deterlab.net.http: tcp 0
17:05:04.980627 IP bpc063.isi.deterlab.net.http > bpc036.isi.deterlab.net.59790: tcp 0
17:05:06.026221 IP bpc036.isi.deterlab.net.59792 > bpc063.isi.deterlab.net.http: tcp 0
17:05:06.026486 IP bpc063.isi.deterlab.net.http > bpc036.isi.deterlab.net.59792: tcp 0
17:05:07.071838 IP bpc036.isi.deterlab.net.59794 > bpc063.isi.deterlab.net.http: tcp 0
17:05:07.072143 IP bpc063.isi.deterlab.net.http > bpc036.isi.deterlab.net.59794: tcp 0
17:05:08.116195 IP bpc036.isi.deterlab.net.59796 > bpc063.isi.deterlab.net.http: tcp 0
17:05:08.116500 IP bpc063.isi.deterlab.net.http > bpc036.isi.deterlab.net.59796: tcp 0
17:05:09.161531 IP bpc036.isi.deterlab.net.59798 > bpc063.isi.deterlab.net.http: tcp 0
17:05:09.161661 IP bpc063.isi.deterlab.net.http > bpc036.isi.deterlab.net.59798: tcp 0
17:05:10.205894 IP bpc036.isi.deterlab.net.59800 > bpc063.isi.deterlab.net.http: tcp 0
17:05:10.206217 IP bpc063.isi.deterlab.net.http > bpc036.isi.deterlab.net.59800: tcp 0
17:05:11.251039 IP bpc036.isi.deterlab.net.59802 > bpc063.isi.deterlab.net.http: tcp 0
17:05:11.251278 IP bpc063.isi.deterlab.net.http > bpc036.isi.deterlab.net.59802: tcp 0
17:05:12.282116 IP bpc036.isi.deterlab.net.59804 > bpc063.isi.deterlab.net.http: tcp 0
17:05:12.282259 IP bpc063.isi.deterlab.net.http > bpc036.isi.deterlab.net.59804: tcp 0
17:05:13.326648 IP bpc036.isi.deterlab.net.59806 > bpc063.isi.deterlab.net.http: tcp 0
17:05:13.326916 IP bpc063.isi.deterlab.net.http > bpc036.isi.deterlab.net.59806: tcp 0
17:05:14.371090 IP bpc036.isi.deterlab.net.59808 > bpc063.isi.deterlab.net.http: tcp 0
17:05:14.371325 IP bpc063.isi.deterlab.net.http > bpc036.isi.deterlab.net.59808: tcp 0
17:05:15.399326 IP bpc036.isi.deterlab.net.59810 > bpc063.isi.deterlab.net.http: tcp 0
17:05:15.399560 IP bpc063.isi.deterlab.net.http > bpc036.isi.deterlab.net.59810: tcp 0
17:05:16.428926 IP bpc036.isi.deterlab.net.59812 > bpc063.isi.deterlab.net.http: tcp 0
17:05:16.429296 IP bpc063.isi.deterlab.net.http > bpc036.isi.deterlab.net.59812: tcp 0
17:05:17.461761 IP bpc036.isi.deterlab.net.59814 > bpc063.isi.deterlab.net.http: tcp 0
17:05:17.461869 IP bpc063.isi.deterlab.net.http > bpc036.isi.deterlab.net.59814: tcp 0
17:05:18.492388 IP bpc036.isi.deterlab.net.59816 > bpc063.isi.deterlab.net.http: tcp 0
17:05:18.492640 IP bpc063.isi.deterlab.net.http > bpc036.isi.deterlab.net.59816: tcp 0
17:05:19.522316 IP bpc036.isi.deterlab.net.59818 > bpc063.isi.deterlab.net.http: tcp 0
17:05:19.522623 IP bpc063.isi.deterlab.net.http > bpc036.isi.deterlab.net.59818: tcp 0
17:05:20.550858 IP bpc036.isi.deterlab.net.59820 > bpc063.isi.deterlab.net.http: tcp 0
17:05:20.551105 IP bpc063.isi.deterlab.net.http > bpc036.isi.deterlab.net.59820: tcp 0
17:05:21.595146 IP bpc036.isi.deterlab.net.59822 > bpc063.isi.deterlab.net.http: tcp 0
17:05:21.595265 IP bpc063.isi.deterlab.net.http > bpc036.isi.deterlab.net.59822: tcp 0
17:05:22.641991 IP bpc036.isi.deterlab.net.59824 > bpc063.isi.deterlab.net.http: tcp 0
17:05:22.642228 IP bpc063.isi.deterlab.net.http > bpc036.isi.deterlab.net.59824: tcp 0
17:05:23.670945 IP bpc036.isi.deterlab.net.59826 > bpc063.isi.deterlab.net.http: tcp 0
17:05:23.671158 IP bpc063.isi.deterlab.net.http > bpc036.isi.deterlab.net.59826: tcp 0
17:05:24.699326 IP bpc036.isi.deterlab.net.59828 > bpc063.isi.deterlab.net.http: tcp 0
17:05:24.699442 IP bpc063.isi.deterlab.net.http > bpc036.isi.deterlab.net.59828: tcp 0
17:05:25.728185 IP bpc036.isi.deterlab.net.59830 > bpc063.isi.deterlab.net.http: tcp 0
17:05:25.728428 IP bpc063.isi.deterlab.net.http > bpc036.isi.deterlab.net.59830: tcp 0
17:05:26.774245 IP bpc036.isi.deterlab.net.59832 > bpc063.isi.deterlab.net.http: tcp 0
17:05:26.774486 IP bpc063.isi.deterlab.net.http > bpc036.isi.deterlab.net.59832: tcp 0
17:05:27.819795 IP bpc036.isi.deterlab.net.59834 > bpc063.isi.deterlab.net.http: tcp 0
17:05:27.820094 IP bpc063.isi.deterlab.net.http > bpc036.isi.deterlab.net.59834: tcp 0
17:05:28.864149 IP bpc036.isi.deterlab.net.59836 > bpc063.isi.deterlab.net.http: tcp 0
17:05:28.864351 IP bpc063.isi.deterlab.net.http > bpc036.isi.deterlab.net.59836: tcp 0
17:05:29.908477 IP bpc036.isi.deterlab.net.59838 > bpc063.isi.deterlab.net.http: tcp 0
17:05:29.908711 IP bpc063.isi.deterlab.net.http > bpc036.isi.deterlab.net.59838: tcp 0
17:05:30.936443 IP bpc036.isi.deterlab.net.59840 > bpc063.isi.deterlab.net.http: tcp 0
17:05:30.936696 IP bpc063.isi.deterlab.net.http > bpc036.isi.deterlab.net.59840: tcp 0
17:05:31.980806 IP bpc036.isi.deterlab.net.59842 > bpc063.isi.deterlab.net.http: tcp 0
17:05:31.981156 IP bpc063.isi.deterlab.net.http > bpc036.isi.deterlab.net.59842: tcp 0
