16:56:39.333063 IP bpc036.isi.deterlab.net.59146 > bpc063.isi.deterlab.net.http: tcp 0
16:56:39.333339 IP bpc063.isi.deterlab.net.http > bpc036.isi.deterlab.net.59146: tcp 0
16:56:40.361306 IP bpc036.isi.deterlab.net.59148 > bpc063.isi.deterlab.net.http: tcp 0
16:56:40.361619 IP bpc063.isi.deterlab.net.http > bpc036.isi.deterlab.net.59148: tcp 0
16:56:41.390807 IP bpc036.isi.deterlab.net.59150 > bpc063.isi.deterlab.net.http: tcp 0
16:56:41.391099 IP bpc063.isi.deterlab.net.http > bpc036.isi.deterlab.net.59150: tcp 0
16:56:42.435286 IP bpc036.isi.deterlab.net.59152 > bpc063.isi.deterlab.net.http: tcp 0
16:56:42.435604 IP bpc063.isi.deterlab.net.http > bpc036.isi.deterlab.net.59152: tcp 0
16:56:43.463521 IP bpc036.isi.deterlab.net.59154 > bpc063.isi.deterlab.net.http: tcp 0
16:56:43.463831 IP bpc063.isi.deterlab.net.http > bpc036.isi.deterlab.net.59154: tcp 0
16:56:44.507745 IP bpc036.isi.deterlab.net.59156 > bpc063.isi.deterlab.net.http: tcp 0
16:56:44.507987 IP bpc063.isi.deterlab.net.http > bpc036.isi.deterlab.net.59156: tcp 0
16:56:45.551996 IP bpc036.isi.deterlab.net.59158 > bpc063.isi.deterlab.net.http: tcp 0
16:56:45.552241 IP bpc063.isi.deterlab.net.http > bpc036.isi.deterlab.net.59158: tcp 0
16:56:46.580498 IP bpc036.isi.deterlab.net.59160 > bpc063.isi.deterlab.net.http: tcp 0
16:56:46.580822 IP bpc063.isi.deterlab.net.http > bpc036.isi.deterlab.net.59160: tcp 0
16:56:47.608576 IP bpc036.isi.deterlab.net.59162 > bpc063.isi.deterlab.net.http: tcp 0
16:56:47.608872 IP bpc063.isi.deterlab.net.http > bpc036.isi.deterlab.net.59162: tcp 0
16:56:48.636673 IP bpc036.isi.deterlab.net.59164 > bpc063.isi.deterlab.net.http: tcp 0
16:56:48.636984 IP bpc063.isi.deterlab.net.http > bpc036.isi.deterlab.net.59164: tcp 0
16:56:49.664649 IP bpc036.isi.deterlab.net.59166 > bpc063.isi.deterlab.net.http: tcp 0
16:56:49.664915 IP bpc063.isi.deterlab.net.http > bpc036.isi.deterlab.net.59166: tcp 0
16:56:50.709339 IP bpc036.isi.deterlab.net.59168 > bpc063.isi.deterlab.net.http: tcp 0
16:56:50.709672 IP bpc063.isi.deterlab.net.http > bpc036.isi.deterlab.net.59168: tcp 0
16:56:51.737549 IP bpc036.isi.deterlab.net.59170 > bpc063.isi.deterlab.net.http: tcp 0
16:56:51.737799 IP bpc063.isi.deterlab.net.http > bpc036.isi.deterlab.net.59170: tcp 0
16:56:52.781780 IP bpc036.isi.deterlab.net.59172 > bpc063.isi.deterlab.net.http: tcp 0
16:56:52.782034 IP bpc063.isi.deterlab.net.http > bpc036.isi.deterlab.net.59172: tcp 0
16:56:53.826128 IP bpc036.isi.deterlab.net.59174 > bpc063.isi.deterlab.net.http: tcp 0
16:56:53.826288 IP bpc063.isi.deterlab.net.http > bpc036.isi.deterlab.net.59174: tcp 0
16:56:54.870485 IP bpc036.isi.deterlab.net.59176 > bpc063.isi.deterlab.net.http: tcp 0
16:56:54.870742 IP bpc063.isi.deterlab.net.http > bpc036.isi.deterlab.net.59176: tcp 0
16:56:55.898740 IP bpc036.isi.deterlab.net.59178 > bpc063.isi.deterlab.net.http: tcp 0
16:56:55.898973 IP bpc063.isi.deterlab.net.http > bpc036.isi.deterlab.net.59178: tcp 0
16:56:56.943036 IP bpc036.isi.deterlab.net.59180 > bpc063.isi.deterlab.net.http: tcp 0
16:56:56.943278 IP bpc063.isi.deterlab.net.http > bpc036.isi.deterlab.net.59180: tcp 0
16:56:57.972179 IP bpc036.isi.deterlab.net.59182 > bpc063.isi.deterlab.net.http: tcp 0
16:56:57.972359 IP bpc063.isi.deterlab.net.http > bpc036.isi.deterlab.net.59182: tcp 0
16:56:59.016661 IP bpc036.isi.deterlab.net.59184 > bpc063.isi.deterlab.net.http: tcp 0
16:56:59.016913 IP bpc063.isi.deterlab.net.http > bpc036.isi.deterlab.net.59184: tcp 0
16:57:00.061078 IP bpc036.isi.deterlab.net.59186 > bpc063.isi.deterlab.net.http: tcp 0
16:57:00.061316 IP bpc063.isi.deterlab.net.http > bpc036.isi.deterlab.net.59186: tcp 0
16:57:01.090726 IP bpc036.isi.deterlab.net.59188 > bpc063.isi.deterlab.net.http: tcp 0
16:57:01.090896 IP bpc063.isi.deterlab.net.http > bpc036.isi.deterlab.net.59188: tcp 0
16:57:02.119964 IP bpc036.isi.deterlab.net.59190 > bpc063.isi.deterlab.net.http: tcp 0
16:57:02.120175 IP bpc063.isi.deterlab.net.http > bpc036.isi.deterlab.net.59190: tcp 0
16:57:03.162441 IP bpc036.isi.deterlab.net.59192 > bpc063.isi.deterlab.net.http: tcp 0
16:57:03.162722 IP bpc063.isi.deterlab.net.http > bpc036.isi.deterlab.net.59192: tcp 0
16:57:04.191627 IP bpc036.isi.deterlab.net.59194 > bpc063.isi.deterlab.net.http: tcp 0
16:57:04.191948 IP bpc063.isi.deterlab.net.http > bpc036.isi.deterlab.net.59194: tcp 0
16:57:05.221365 IP bpc036.isi.deterlab.net.59196 > bpc063.isi.deterlab.net.http: tcp 0
16:57:05.221630 IP bpc063.isi.deterlab.net.http > bpc036.isi.deterlab.net.59196: tcp 0
16:57:06.250169 IP bpc036.isi.deterlab.net.59198 > bpc063.isi.deterlab.net.http: tcp 0
16:57:06.250358 IP bpc063.isi.deterlab.net.http > bpc036.isi.deterlab.net.59198: tcp 0
16:57:07.294656 IP bpc036.isi.deterlab.net.59200 > bpc063.isi.deterlab.net.http: tcp 0
16:57:07.294912 IP bpc063.isi.deterlab.net.http > bpc036.isi.deterlab.net.59200: tcp 0
16:57:08.324520 IP bpc036.isi.deterlab.net.59202 > bpc063.isi.deterlab.net.http: tcp 0
16:57:08.324691 IP bpc063.isi.deterlab.net.http > bpc036.isi.deterlab.net.59202: tcp 0
16:57:09.355491 IP bpc036.isi.deterlab.net.59204 > bpc063.isi.deterlab.net.http: tcp 0
16:57:09.355668 IP bpc063.isi.deterlab.net.http > bpc036.isi.deterlab.net.59204: tcp 0
16:57:10.386248 IP bpc036.isi.deterlab.net.59206 > bpc063.isi.deterlab.net.http: tcp 0
16:57:10.386394 IP bpc063.isi.deterlab.net.http > bpc036.isi.deterlab.net.59206: tcp 0
16:57:11.416073 IP bpc036.isi.deterlab.net.59208 > bpc063.isi.deterlab.net.http: tcp 0
16:57:11.416276 IP bpc063.isi.deterlab.net.http > bpc036.isi.deterlab.net.59208: tcp 0
16:57:12.460495 IP bpc036.isi.deterlab.net.59210 > bpc063.isi.deterlab.net.http: tcp 0
16:57:12.460729 IP bpc063.isi.deterlab.net.http > bpc036.isi.deterlab.net.59210: tcp 0
16:57:13.506480 IP bpc036.isi.deterlab.net.59212 > bpc063.isi.deterlab.net.http: tcp 0
16:57:13.506833 IP bpc063.isi.deterlab.net.http > bpc036.isi.deterlab.net.59212: tcp 0
16:57:14.550844 IP bpc036.isi.deterlab.net.59214 > bpc063.isi.deterlab.net.http: tcp 0
16:57:14.551086 IP bpc063.isi.deterlab.net.http > bpc036.isi.deterlab.net.59214: tcp 0
16:57:15.596235 IP bpc036.isi.deterlab.net.59216 > bpc063.isi.deterlab.net.http: tcp 0
16:57:15.596540 IP bpc063.isi.deterlab.net.http > bpc036.isi.deterlab.net.59216: tcp 0
16:57:16.640592 IP bpc036.isi.deterlab.net.59218 > bpc063.isi.deterlab.net.http: tcp 0
16:57:16.640793 IP bpc063.isi.deterlab.net.http > bpc036.isi.deterlab.net.59218: tcp 0
16:57:17.670310 IP bpc036.isi.deterlab.net.59220 > bpc063.isi.deterlab.net.http: tcp 0
16:57:17.670423 IP bpc063.isi.deterlab.net.http > bpc036.isi.deterlab.net.59220: tcp 0
16:57:18.714621 IP bpc036.isi.deterlab.net.59222 > bpc063.isi.deterlab.net.http: tcp 0
16:57:18.714728 IP bpc063.isi.deterlab.net.http > bpc036.isi.deterlab.net.59222: tcp 0
16:57:19.758933 IP bpc036.isi.deterlab.net.59224 > bpc063.isi.deterlab.net.http: tcp 0
16:57:19.759182 IP bpc063.isi.deterlab.net.http > bpc036.isi.deterlab.net.59224: tcp 0
16:57:20.803315 IP bpc036.isi.deterlab.net.59226 > bpc063.isi.deterlab.net.http: tcp 0
16:57:20.803536 IP bpc063.isi.deterlab.net.http > bpc036.isi.deterlab.net.59226: tcp 0
16:57:21.847606 IP bpc036.isi.deterlab.net.59228 > bpc063.isi.deterlab.net.http: tcp 0
16:57:21.847840 IP bpc063.isi.deterlab.net.http > bpc036.isi.deterlab.net.59228: tcp 0
16:57:22.891682 IP bpc036.isi.deterlab.net.59230 > bpc063.isi.deterlab.net.http: tcp 0
16:57:22.891818 IP bpc063.isi.deterlab.net.http > bpc036.isi.deterlab.net.59230: tcp 0
16:57:23.936025 IP bpc036.isi.deterlab.net.59232 > bpc063.isi.deterlab.net.http: tcp 0
16:57:23.936224 IP bpc063.isi.deterlab.net.http > bpc036.isi.deterlab.net.59232: tcp 0
16:57:24.980325 IP bpc036.isi.deterlab.net.59234 > bpc063.isi.deterlab.net.http: tcp 0
16:57:24.980578 IP bpc063.isi.deterlab.net.http > bpc036.isi.deterlab.net.59234: tcp 0
16:57:26.009521 IP bpc036.isi.deterlab.net.59236 > bpc063.isi.deterlab.net.http: tcp 0
16:57:26.009862 IP bpc063.isi.deterlab.net.http > bpc036.isi.deterlab.net.59236: tcp 0
16:57:27.037525 IP bpc036.isi.deterlab.net.59238 > bpc063.isi.deterlab.net.http: tcp 0
16:57:27.037748 IP bpc063.isi.deterlab.net.http > bpc036.isi.deterlab.net.59238: tcp 0
16:57:28.082938 IP bpc036.isi.deterlab.net.59240 > bpc063.isi.deterlab.net.http: tcp 0
16:57:28.083123 IP bpc063.isi.deterlab.net.http > bpc036.isi.deterlab.net.59240: tcp 0
16:57:29.127445 IP bpc036.isi.deterlab.net.59242 > bpc063.isi.deterlab.net.http: tcp 0
16:57:29.127726 IP bpc063.isi.deterlab.net.http > bpc036.isi.deterlab.net.59242: tcp 0
16:57:30.157091 IP bpc036.isi.deterlab.net.59244 > bpc063.isi.deterlab.net.http: tcp 0
16:57:30.157407 IP bpc063.isi.deterlab.net.http > bpc036.isi.deterlab.net.59244: tcp 0
16:57:31.185405 IP bpc036.isi.deterlab.net.59246 > bpc063.isi.deterlab.net.http: tcp 0
16:57:31.185685 IP bpc063.isi.deterlab.net.http > bpc036.isi.deterlab.net.59246: tcp 0
16:57:32.231440 IP bpc036.isi.deterlab.net.59248 > bpc063.isi.deterlab.net.http: tcp 0
16:57:32.231589 IP bpc063.isi.deterlab.net.http > bpc036.isi.deterlab.net.59248: tcp 0
16:57:33.273342 IP bpc036.isi.deterlab.net.59250 > bpc063.isi.deterlab.net.http: tcp 0
16:57:33.273550 IP bpc063.isi.deterlab.net.http > bpc036.isi.deterlab.net.59250: tcp 0
16:57:34.302803 IP bpc036.isi.deterlab.net.59252 > bpc063.isi.deterlab.net.http: tcp 0
16:57:34.303178 IP bpc063.isi.deterlab.net.http > bpc036.isi.deterlab.net.59252: tcp 0
16:57:35.331429 IP bpc036.isi.deterlab.net.59254 > bpc063.isi.deterlab.net.http: tcp 0
16:57:35.331658 IP bpc063.isi.deterlab.net.http > bpc036.isi.deterlab.net.59254: tcp 0
16:57:36.377497 IP bpc036.isi.deterlab.net.59256 > bpc063.isi.deterlab.net.http: tcp 0
16:57:36.377611 IP bpc063.isi.deterlab.net.http > bpc036.isi.deterlab.net.59256: tcp 0
16:57:37.407523 IP bpc036.isi.deterlab.net.59258 > bpc063.isi.deterlab.net.http: tcp 0
16:57:37.407739 IP bpc063.isi.deterlab.net.http > bpc036.isi.deterlab.net.59258: tcp 0
16:57:38.437550 IP bpc036.isi.deterlab.net.59260 > bpc063.isi.deterlab.net.http: tcp 0
16:57:38.437716 IP bpc063.isi.deterlab.net.http > bpc036.isi.deterlab.net.59260: tcp 0
16:57:39.466894 IP bpc036.isi.deterlab.net.59262 > bpc063.isi.deterlab.net.http: tcp 0
16:57:39.467196 IP bpc063.isi.deterlab.net.http > bpc036.isi.deterlab.net.59262: tcp 0
16:57:40.495646 IP bpc036.isi.deterlab.net.59264 > bpc063.isi.deterlab.net.http: tcp 0
16:57:40.496026 IP bpc063.isi.deterlab.net.http > bpc036.isi.deterlab.net.59264: tcp 0
16:57:41.524404 IP bpc036.isi.deterlab.net.59266 > bpc063.isi.deterlab.net.http: tcp 0
16:57:41.524605 IP bpc063.isi.deterlab.net.http > bpc036.isi.deterlab.net.59266: tcp 0
16:57:42.556370 IP bpc036.isi.deterlab.net.59268 > bpc063.isi.deterlab.net.http: tcp 0
16:57:42.556747 IP bpc063.isi.deterlab.net.http > bpc036.isi.deterlab.net.59268: tcp 0
16:57:43.585357 IP bpc036.isi.deterlab.net.59270 > bpc063.isi.deterlab.net.http: tcp 0
16:57:43.585725 IP bpc063.isi.deterlab.net.http > bpc036.isi.deterlab.net.59270: tcp 0
16:57:44.614848 IP bpc036.isi.deterlab.net.59272 > bpc063.isi.deterlab.net.http: tcp 0
16:57:44.615156 IP bpc063.isi.deterlab.net.http > bpc036.isi.deterlab.net.59272: tcp 0
16:57:45.647063 IP bpc036.isi.deterlab.net.59274 > bpc063.isi.deterlab.net.http: tcp 0
16:57:45.647282 IP bpc063.isi.deterlab.net.http > bpc036.isi.deterlab.net.59274: tcp 0
16:57:46.675952 IP bpc036.isi.deterlab.net.59276 > bpc063.isi.deterlab.net.http: tcp 0
16:57:46.676161 IP bpc063.isi.deterlab.net.http > bpc036.isi.deterlab.net.59276: tcp 0
16:57:47.706735 IP bpc036.isi.deterlab.net.59278 > bpc063.isi.deterlab.net.http: tcp 0
16:57:47.707089 IP bpc063.isi.deterlab.net.http > bpc036.isi.deterlab.net.59278: tcp 0
16:57:48.735424 IP bpc036.isi.deterlab.net.59280 > bpc063.isi.deterlab.net.http: tcp 0
16:57:48.735769 IP bpc063.isi.deterlab.net.http > bpc036.isi.deterlab.net.59280: tcp 0
16:57:49.763679 IP bpc036.isi.deterlab.net.59282 > bpc063.isi.deterlab.net.http: tcp 0
16:57:49.763901 IP bpc063.isi.deterlab.net.http > bpc036.isi.deterlab.net.59282: tcp 0
16:57:50.791952 IP bpc036.isi.deterlab.net.59284 > bpc063.isi.deterlab.net.http: tcp 0
16:57:50.792133 IP bpc063.isi.deterlab.net.http > bpc036.isi.deterlab.net.59284: tcp 0
16:57:51.837643 IP bpc036.isi.deterlab.net.59286 > bpc063.isi.deterlab.net.http: tcp 0
16:57:51.838034 IP bpc063.isi.deterlab.net.http > bpc036.isi.deterlab.net.59286: tcp 0
16:57:52.866942 IP bpc036.isi.deterlab.net.59288 > bpc063.isi.deterlab.net.http: tcp 0
16:57:52.867165 IP bpc063.isi.deterlab.net.http > bpc036.isi.deterlab.net.59288: tcp 0
16:57:53.911735 IP bpc036.isi.deterlab.net.59290 > bpc063.isi.deterlab.net.http: tcp 0
16:57:53.911918 IP bpc063.isi.deterlab.net.http > bpc036.isi.deterlab.net.59290: tcp 0
16:57:54.940689 IP bpc036.isi.deterlab.net.59292 > bpc063.isi.deterlab.net.http: tcp 0
16:57:54.941049 IP bpc063.isi.deterlab.net.http > bpc036.isi.deterlab.net.59292: tcp 0
16:57:55.970099 IP bpc036.isi.deterlab.net.59294 > bpc063.isi.deterlab.net.http: tcp 0
16:57:55.970478 IP bpc063.isi.deterlab.net.http > bpc036.isi.deterlab.net.59294: tcp 0
16:57:56.999082 IP bpc036.isi.deterlab.net.59296 > bpc063.isi.deterlab.net.http: tcp 0
16:57:56.999258 IP bpc063.isi.deterlab.net.http > bpc036.isi.deterlab.net.59296: tcp 0
16:57:58.028066 IP bpc036.isi.deterlab.net.59298 > bpc063.isi.deterlab.net.http: tcp 0
16:57:58.028382 IP bpc063.isi.deterlab.net.http > bpc036.isi.deterlab.net.59298: tcp 0
16:57:59.056825 IP bpc036.isi.deterlab.net.59300 > bpc063.isi.deterlab.net.http: tcp 0
16:57:59.057160 IP bpc063.isi.deterlab.net.http > bpc036.isi.deterlab.net.59300: tcp 0
16:58:00.085854 IP bpc036.isi.deterlab.net.59302 > bpc063.isi.deterlab.net.http: tcp 0
16:58:00.085989 IP bpc063.isi.deterlab.net.http > bpc036.isi.deterlab.net.59302: tcp 0
16:58:01.114687 IP bpc036.isi.deterlab.net.59304 > bpc063.isi.deterlab.net.http: tcp 0
16:58:01.115020 IP bpc063.isi.deterlab.net.http > bpc036.isi.deterlab.net.59304: tcp 0
16:58:02.143266 IP bpc036.isi.deterlab.net.59306 > bpc063.isi.deterlab.net.http: tcp 0
16:58:02.143656 IP bpc063.isi.deterlab.net.http > bpc036.isi.deterlab.net.59306: tcp 0
16:58:03.174255 IP bpc036.isi.deterlab.net.59308 > bpc063.isi.deterlab.net.http: tcp 0
16:58:03.174455 IP bpc063.isi.deterlab.net.http > bpc036.isi.deterlab.net.59308: tcp 0
16:58:04.203755 IP bpc036.isi.deterlab.net.59310 > bpc063.isi.deterlab.net.http: tcp 0
16:58:04.203984 IP bpc063.isi.deterlab.net.http > bpc036.isi.deterlab.net.59310: tcp 0
16:58:05.233137 IP bpc036.isi.deterlab.net.59312 > bpc063.isi.deterlab.net.http: tcp 0
16:58:05.233366 IP bpc063.isi.deterlab.net.http > bpc036.isi.deterlab.net.59312: tcp 0
16:58:06.262560 IP bpc036.isi.deterlab.net.59314 > bpc063.isi.deterlab.net.http: tcp 0
16:58:06.262745 IP bpc063.isi.deterlab.net.http > bpc036.isi.deterlab.net.59314: tcp 0
16:58:07.291567 IP bpc036.isi.deterlab.net.59316 > bpc063.isi.deterlab.net.http: tcp 0
16:58:07.291874 IP bpc063.isi.deterlab.net.http > bpc036.isi.deterlab.net.59316: tcp 0
16:58:08.337588 IP bpc036.isi.deterlab.net.59318 > bpc063.isi.deterlab.net.http: tcp 0
16:58:08.337779 IP bpc063.isi.deterlab.net.http > bpc036.isi.deterlab.net.59318: tcp 0
16:58:09.382068 IP bpc036.isi.deterlab.net.59320 > bpc063.isi.deterlab.net.http: tcp 0
16:58:09.382232 IP bpc063.isi.deterlab.net.http > bpc036.isi.deterlab.net.59320: tcp 0
16:58:10.410300 IP bpc036.isi.deterlab.net.59322 > bpc063.isi.deterlab.net.http: tcp 0
16:58:10.410465 IP bpc063.isi.deterlab.net.http > bpc036.isi.deterlab.net.59322: tcp 0
16:58:11.454715 IP bpc036.isi.deterlab.net.59324 > bpc063.isi.deterlab.net.http: tcp 0
16:58:11.454969 IP bpc063.isi.deterlab.net.http > bpc036.isi.deterlab.net.59324: tcp 0
16:58:12.484878 IP bpc036.isi.deterlab.net.59326 > bpc063.isi.deterlab.net.http: tcp 0
16:58:12.485049 IP bpc063.isi.deterlab.net.http > bpc036.isi.deterlab.net.59326: tcp 0
16:58:13.513617 IP bpc036.isi.deterlab.net.59328 > bpc063.isi.deterlab.net.http: tcp 0
16:58:13.513980 IP bpc063.isi.deterlab.net.http > bpc036.isi.deterlab.net.59328: tcp 0
16:58:14.543494 IP bpc036.isi.deterlab.net.59330 > bpc063.isi.deterlab.net.http: tcp 0
16:58:14.543657 IP bpc063.isi.deterlab.net.http > bpc036.isi.deterlab.net.59330: tcp 0
16:58:15.572672 IP bpc036.isi.deterlab.net.59332 > bpc063.isi.deterlab.net.http: tcp 0
16:58:15.572837 IP bpc063.isi.deterlab.net.http > bpc036.isi.deterlab.net.59332: tcp 0
16:58:16.601536 IP bpc036.isi.deterlab.net.59334 > bpc063.isi.deterlab.net.http: tcp 0
16:58:16.601819 IP bpc063.isi.deterlab.net.http > bpc036.isi.deterlab.net.59334: tcp 0
16:58:17.630409 IP bpc036.isi.deterlab.net.59336 > bpc063.isi.deterlab.net.http: tcp 0
16:58:17.630799 IP bpc063.isi.deterlab.net.http > bpc036.isi.deterlab.net.59336: tcp 0
16:58:18.662483 IP bpc036.isi.deterlab.net.59338 > bpc063.isi.deterlab.net.http: tcp 0
16:58:18.662725 IP bpc063.isi.deterlab.net.http > bpc036.isi.deterlab.net.59338: tcp 0
16:58:19.691671 IP bpc036.isi.deterlab.net.59340 > bpc063.isi.deterlab.net.http: tcp 0
16:58:19.691955 IP bpc063.isi.deterlab.net.http > bpc036.isi.deterlab.net.59340: tcp 0
16:58:20.720626 IP bpc036.isi.deterlab.net.59342 > bpc063.isi.deterlab.net.http: tcp 0
16:58:20.720785 IP bpc063.isi.deterlab.net.http > bpc036.isi.deterlab.net.59342: tcp 0
16:58:21.749436 IP bpc036.isi.deterlab.net.59344 > bpc063.isi.deterlab.net.http: tcp 0
16:58:21.749717 IP bpc063.isi.deterlab.net.http > bpc036.isi.deterlab.net.59344: tcp 0
16:58:22.778187 IP bpc036.isi.deterlab.net.59346 > bpc063.isi.deterlab.net.http: tcp 0
16:58:22.778347 IP bpc063.isi.deterlab.net.http > bpc036.isi.deterlab.net.59346: tcp 0
16:58:23.806895 IP bpc036.isi.deterlab.net.59348 > bpc063.isi.deterlab.net.http: tcp 0
16:58:23.807279 IP bpc063.isi.deterlab.net.http > bpc036.isi.deterlab.net.59348: tcp 0
16:58:24.835708 IP bpc036.isi.deterlab.net.59350 > bpc063.isi.deterlab.net.http: tcp 0
16:58:24.835909 IP bpc063.isi.deterlab.net.http > bpc036.isi.deterlab.net.59350: tcp 0
16:58:25.864791 IP bpc036.isi.deterlab.net.59352 > bpc063.isi.deterlab.net.http: tcp 0
16:58:25.864939 IP bpc063.isi.deterlab.net.http > bpc036.isi.deterlab.net.59352: tcp 0
16:58:26.895828 IP bpc036.isi.deterlab.net.59354 > bpc063.isi.deterlab.net.http: tcp 0
16:58:26.896018 IP bpc063.isi.deterlab.net.http > bpc036.isi.deterlab.net.59354: tcp 0
16:58:27.926471 IP bpc036.isi.deterlab.net.59356 > bpc063.isi.deterlab.net.http: tcp 0
16:58:27.926744 IP bpc063.isi.deterlab.net.http > bpc036.isi.deterlab.net.59356: tcp 0
16:58:29.068128 IP bpc036.isi.deterlab.net.59358 > bpc063.isi.deterlab.net.http: tcp 0
16:58:29.068242 IP bpc063.isi.deterlab.net.http > bpc036.isi.deterlab.net.59358: tcp 0
16:58:30.097087 IP bpc036.isi.deterlab.net.59360 > bpc063.isi.deterlab.net.http: tcp 0
16:58:30.097423 IP bpc063.isi.deterlab.net.http > bpc036.isi.deterlab.net.59360: tcp 0
16:58:31.125940 IP bpc036.isi.deterlab.net.59362 > bpc063.isi.deterlab.net.http: tcp 0
16:58:31.126102 IP bpc063.isi.deterlab.net.http > bpc036.isi.deterlab.net.59362: tcp 0
16:58:32.154470 IP bpc036.isi.deterlab.net.59364 > bpc063.isi.deterlab.net.http: tcp 0
16:58:32.154733 IP bpc063.isi.deterlab.net.http > bpc036.isi.deterlab.net.59364: tcp 0
16:58:33.198907 IP bpc036.isi.deterlab.net.59366 > bpc063.isi.deterlab.net.http: tcp 0
16:58:33.199139 IP bpc063.isi.deterlab.net.http > bpc036.isi.deterlab.net.59366: tcp 0
16:58:34.241911 IP bpc036.isi.deterlab.net.59368 > bpc063.isi.deterlab.net.http: tcp 0
16:58:34.242151 IP bpc063.isi.deterlab.net.http > bpc036.isi.deterlab.net.59368: tcp 0
16:58:35.270297 IP bpc036.isi.deterlab.net.59370 > bpc063.isi.deterlab.net.http: tcp 0
16:58:35.270529 IP bpc063.isi.deterlab.net.http > bpc036.isi.deterlab.net.59370: tcp 0
16:58:36.314897 IP bpc036.isi.deterlab.net.59372 > bpc063.isi.deterlab.net.http: tcp 0
16:58:36.315086 IP bpc063.isi.deterlab.net.http > bpc036.isi.deterlab.net.59372: tcp 0
16:58:37.359211 IP bpc036.isi.deterlab.net.59374 > bpc063.isi.deterlab.net.http: tcp 0
16:58:37.359580 IP bpc063.isi.deterlab.net.http > bpc036.isi.deterlab.net.59374: tcp 0
16:58:38.403332 IP bpc036.isi.deterlab.net.59376 > bpc063.isi.deterlab.net.http: tcp 0
16:58:38.403684 IP bpc063.isi.deterlab.net.http > bpc036.isi.deterlab.net.59376: tcp 0
16:58:39.447550 IP bpc036.isi.deterlab.net.59378 > bpc063.isi.deterlab.net.http: tcp 0
16:58:39.447741 IP bpc063.isi.deterlab.net.http > bpc036.isi.deterlab.net.59378: tcp 0
16:58:40.491831 IP bpc036.isi.deterlab.net.59380 > bpc063.isi.deterlab.net.http: tcp 0
16:58:40.492096 IP bpc063.isi.deterlab.net.http > bpc036.isi.deterlab.net.59380: tcp 0
16:58:41.537427 IP bpc036.isi.deterlab.net.59382 > bpc063.isi.deterlab.net.http: tcp 0
16:58:41.537754 IP bpc063.isi.deterlab.net.http > bpc036.isi.deterlab.net.59382: tcp 0
16:58:42.581792 IP bpc036.isi.deterlab.net.59384 > bpc063.isi.deterlab.net.http: tcp 0
16:58:42.582006 IP bpc063.isi.deterlab.net.http > bpc036.isi.deterlab.net.59384: tcp 0
16:58:43.626658 IP bpc036.isi.deterlab.net.59386 > bpc063.isi.deterlab.net.http: tcp 0
16:58:43.627010 IP bpc063.isi.deterlab.net.http > bpc036.isi.deterlab.net.59386: tcp 0
16:58:44.656425 IP bpc036.isi.deterlab.net.59388 > bpc063.isi.deterlab.net.http: tcp 0
16:58:44.656690 IP bpc063.isi.deterlab.net.http > bpc036.isi.deterlab.net.59388: tcp 0
16:58:45.685293 IP bpc036.isi.deterlab.net.59390 > bpc063.isi.deterlab.net.http: tcp 0
16:58:45.685571 IP bpc063.isi.deterlab.net.http > bpc036.isi.deterlab.net.59390: tcp 0
16:58:46.730947 IP bpc036.isi.deterlab.net.59392 > bpc063.isi.deterlab.net.http: tcp 0
16:58:46.731327 IP bpc063.isi.deterlab.net.http > bpc036.isi.deterlab.net.59392: tcp 0
16:58:47.759352 IP bpc036.isi.deterlab.net.59394 > bpc063.isi.deterlab.net.http: tcp 0
16:58:47.759606 IP bpc063.isi.deterlab.net.http > bpc036.isi.deterlab.net.59394: tcp 0
16:58:48.803662 IP bpc036.isi.deterlab.net.59396 > bpc063.isi.deterlab.net.http: tcp 0
16:58:48.803912 IP bpc063.isi.deterlab.net.http > bpc036.isi.deterlab.net.59396: tcp 0
16:58:49.848076 IP bpc036.isi.deterlab.net.59398 > bpc063.isi.deterlab.net.http: tcp 0
16:58:49.848318 IP bpc063.isi.deterlab.net.http > bpc036.isi.deterlab.net.59398: tcp 0
16:58:50.892244 IP bpc036.isi.deterlab.net.59400 > bpc063.isi.deterlab.net.http: tcp 0
16:58:50.892374 IP bpc063.isi.deterlab.net.http > bpc036.isi.deterlab.net.59400: tcp 0
16:58:51.938198 IP bpc036.isi.deterlab.net.59402 > bpc063.isi.deterlab.net.http: tcp 0
16:58:51.938530 IP bpc063.isi.deterlab.net.http > bpc036.isi.deterlab.net.59402: tcp 0
16:58:52.966677 IP bpc036.isi.deterlab.net.59404 > bpc063.isi.deterlab.net.http: tcp 0
16:58:52.966909 IP bpc063.isi.deterlab.net.http > bpc036.isi.deterlab.net.59404: tcp 0
16:58:54.011022 IP bpc036.isi.deterlab.net.59406 > bpc063.isi.deterlab.net.http: tcp 0
16:58:54.011265 IP bpc063.isi.deterlab.net.http > bpc036.isi.deterlab.net.59406: tcp 0
16:58:55.039429 IP bpc036.isi.deterlab.net.59408 > bpc063.isi.deterlab.net.http: tcp 0
16:58:55.039647 IP bpc063.isi.deterlab.net.http > bpc036.isi.deterlab.net.59408: tcp 0
16:58:56.067481 IP bpc036.isi.deterlab.net.59410 > bpc063.isi.deterlab.net.http: tcp 0
16:58:56.067778 IP bpc063.isi.deterlab.net.http > bpc036.isi.deterlab.net.59410: tcp 0
16:58:57.111788 IP bpc036.isi.deterlab.net.59412 > bpc063.isi.deterlab.net.http: tcp 0
16:58:57.112035 IP bpc063.isi.deterlab.net.http > bpc036.isi.deterlab.net.59412: tcp 0
16:58:58.139870 IP bpc036.isi.deterlab.net.59414 > bpc063.isi.deterlab.net.http: tcp 0
16:58:58.140117 IP bpc063.isi.deterlab.net.http > bpc036.isi.deterlab.net.59414: tcp 0
16:58:59.184242 IP bpc036.isi.deterlab.net.59416 > bpc063.isi.deterlab.net.http: tcp 0
16:58:59.184473 IP bpc063.isi.deterlab.net.http > bpc036.isi.deterlab.net.59416: tcp 0
16:59:00.213600 IP bpc036.isi.deterlab.net.59418 > bpc063.isi.deterlab.net.http: tcp 0
16:59:00.213957 IP bpc063.isi.deterlab.net.http > bpc036.isi.deterlab.net.59418: tcp 0
16:59:01.241864 IP bpc036.isi.deterlab.net.59420 > bpc063.isi.deterlab.net.http: tcp 0
16:59:01.242086 IP bpc063.isi.deterlab.net.http > bpc036.isi.deterlab.net.59420: tcp 0
16:59:02.286094 IP bpc036.isi.deterlab.net.59422 > bpc063.isi.deterlab.net.http: tcp 0
16:59:02.286392 IP bpc063.isi.deterlab.net.http > bpc036.isi.deterlab.net.59422: tcp 0
16:59:03.331171 IP bpc036.isi.deterlab.net.59424 > bpc063.isi.deterlab.net.http: tcp 0
16:59:03.331399 IP bpc063.isi.deterlab.net.http > bpc036.isi.deterlab.net.59424: tcp 0
16:59:04.363341 IP bpc036.isi.deterlab.net.59426 > bpc063.isi.deterlab.net.http: tcp 0
16:59:04.363524 IP bpc063.isi.deterlab.net.http > bpc036.isi.deterlab.net.59426: tcp 0
16:59:05.392575 IP bpc036.isi.deterlab.net.59428 > bpc063.isi.deterlab.net.http: tcp 0
16:59:05.392754 IP bpc063.isi.deterlab.net.http > bpc036.isi.deterlab.net.59428: tcp 0
16:59:06.421659 IP bpc036.isi.deterlab.net.59430 > bpc063.isi.deterlab.net.http: tcp 0
16:59:06.421885 IP bpc063.isi.deterlab.net.http > bpc036.isi.deterlab.net.59430: tcp 0
16:59:07.450615 IP bpc036.isi.deterlab.net.59432 > bpc063.isi.deterlab.net.http: tcp 0
16:59:07.450934 IP bpc063.isi.deterlab.net.http > bpc036.isi.deterlab.net.59432: tcp 0
16:59:08.495514 IP bpc036.isi.deterlab.net.59434 > bpc063.isi.deterlab.net.http: tcp 0
16:59:08.495689 IP bpc063.isi.deterlab.net.http > bpc036.isi.deterlab.net.59434: tcp 0
16:59:09.523933 IP bpc036.isi.deterlab.net.59436 > bpc063.isi.deterlab.net.http: tcp 0
16:59:09.524071 IP bpc063.isi.deterlab.net.http > bpc036.isi.deterlab.net.59436: tcp 0
16:59:10.552283 IP bpc036.isi.deterlab.net.59438 > bpc063.isi.deterlab.net.http: tcp 0
16:59:10.552402 IP bpc063.isi.deterlab.net.http > bpc036.isi.deterlab.net.59438: tcp 0
16:59:11.598041 IP bpc036.isi.deterlab.net.59440 > bpc063.isi.deterlab.net.http: tcp 0
16:59:11.598309 IP bpc063.isi.deterlab.net.http > bpc036.isi.deterlab.net.59440: tcp 0
16:59:12.627571 IP bpc036.isi.deterlab.net.59442 > bpc063.isi.deterlab.net.http: tcp 0
16:59:12.627787 IP bpc063.isi.deterlab.net.http > bpc036.isi.deterlab.net.59442: tcp 0
16:59:13.659543 IP bpc036.isi.deterlab.net.59444 > bpc063.isi.deterlab.net.http: tcp 0
16:59:13.659900 IP bpc063.isi.deterlab.net.http > bpc036.isi.deterlab.net.59444: tcp 0
16:59:14.688370 IP bpc036.isi.deterlab.net.59446 > bpc063.isi.deterlab.net.http: tcp 0
16:59:14.688731 IP bpc063.isi.deterlab.net.http > bpc036.isi.deterlab.net.59446: tcp 0
16:59:15.717535 IP bpc036.isi.deterlab.net.59448 > bpc063.isi.deterlab.net.http: tcp 0
16:59:15.717862 IP bpc063.isi.deterlab.net.http > bpc036.isi.deterlab.net.59448: tcp 0
16:59:16.746313 IP bpc036.isi.deterlab.net.59450 > bpc063.isi.deterlab.net.http: tcp 0
16:59:16.746493 IP bpc063.isi.deterlab.net.http > bpc036.isi.deterlab.net.59450: tcp 0
16:59:17.774940 IP bpc036.isi.deterlab.net.59452 > bpc063.isi.deterlab.net.http: tcp 0
16:59:17.775275 IP bpc063.isi.deterlab.net.http > bpc036.isi.deterlab.net.59452: tcp 0
16:59:18.803906 IP bpc036.isi.deterlab.net.59454 > bpc063.isi.deterlab.net.http: tcp 0
16:59:18.804056 IP bpc063.isi.deterlab.net.http > bpc036.isi.deterlab.net.59454: tcp 0
16:59:19.832913 IP bpc036.isi.deterlab.net.59456 > bpc063.isi.deterlab.net.http: tcp 0
16:59:19.833086 IP bpc063.isi.deterlab.net.http > bpc036.isi.deterlab.net.59456: tcp 0
16:59:20.861909 IP bpc036.isi.deterlab.net.59458 > bpc063.isi.deterlab.net.http: tcp 0
16:59:20.862269 IP bpc063.isi.deterlab.net.http > bpc036.isi.deterlab.net.59458: tcp 0
16:59:21.890867 IP bpc036.isi.deterlab.net.59460 > bpc063.isi.deterlab.net.http: tcp 0
16:59:21.890999 IP bpc063.isi.deterlab.net.http > bpc036.isi.deterlab.net.59460: tcp 0
16:59:22.919816 IP bpc036.isi.deterlab.net.59462 > bpc063.isi.deterlab.net.http: tcp 0
16:59:22.920030 IP bpc063.isi.deterlab.net.http > bpc036.isi.deterlab.net.59462: tcp 0
16:59:23.948601 IP bpc036.isi.deterlab.net.59464 > bpc063.isi.deterlab.net.http: tcp 0
16:59:23.948761 IP bpc063.isi.deterlab.net.http > bpc036.isi.deterlab.net.59464: tcp 0
16:59:24.977515 IP bpc036.isi.deterlab.net.59466 > bpc063.isi.deterlab.net.http: tcp 0
16:59:24.977692 IP bpc063.isi.deterlab.net.http > bpc036.isi.deterlab.net.59466: tcp 0
16:59:26.006624 IP bpc036.isi.deterlab.net.59468 > bpc063.isi.deterlab.net.http: tcp 0
16:59:26.006774 IP bpc063.isi.deterlab.net.http > bpc036.isi.deterlab.net.59468: tcp 0
16:59:27.035591 IP bpc036.isi.deterlab.net.59470 > bpc063.isi.deterlab.net.http: tcp 0
16:59:27.035906 IP bpc063.isi.deterlab.net.http > bpc036.isi.deterlab.net.59470: tcp 0
16:59:28.064648 IP bpc036.isi.deterlab.net.59472 > bpc063.isi.deterlab.net.http: tcp 0
16:59:28.064828 IP bpc063.isi.deterlab.net.http > bpc036.isi.deterlab.net.59472: tcp 0
16:59:29.093400 IP bpc036.isi.deterlab.net.59474 > bpc063.isi.deterlab.net.http: tcp 0
16:59:29.093560 IP bpc063.isi.deterlab.net.http > bpc036.isi.deterlab.net.59474: tcp 0
16:59:30.123796 IP bpc036.isi.deterlab.net.59476 > bpc063.isi.deterlab.net.http: tcp 0
16:59:30.124042 IP bpc063.isi.deterlab.net.http > bpc036.isi.deterlab.net.59476: tcp 0
16:59:31.153571 IP bpc036.isi.deterlab.net.59478 > bpc063.isi.deterlab.net.http: tcp 0
16:59:31.153872 IP bpc063.isi.deterlab.net.http > bpc036.isi.deterlab.net.59478: tcp 0
16:59:32.183023 IP bpc036.isi.deterlab.net.59480 > bpc063.isi.deterlab.net.http: tcp 0
16:59:32.183250 IP bpc063.isi.deterlab.net.http > bpc036.isi.deterlab.net.59480: tcp 0
16:59:33.211466 IP bpc036.isi.deterlab.net.59482 > bpc063.isi.deterlab.net.http: tcp 0
16:59:33.211682 IP bpc063.isi.deterlab.net.http > bpc036.isi.deterlab.net.59482: tcp 0
16:59:34.267751 IP bpc036.isi.deterlab.net.59484 > bpc063.isi.deterlab.net.http: tcp 0
16:59:34.267972 IP bpc063.isi.deterlab.net.http > bpc036.isi.deterlab.net.59484: tcp 0
16:59:35.299866 IP bpc036.isi.deterlab.net.59486 > bpc063.isi.deterlab.net.http: tcp 0
16:59:35.300144 IP bpc063.isi.deterlab.net.http > bpc036.isi.deterlab.net.59486: tcp 0
16:59:36.331558 IP bpc036.isi.deterlab.net.59488 > bpc063.isi.deterlab.net.http: tcp 0
16:59:36.331863 IP bpc063.isi.deterlab.net.http > bpc036.isi.deterlab.net.59488: tcp 0
16:59:37.360065 IP bpc036.isi.deterlab.net.59490 > bpc063.isi.deterlab.net.http: tcp 0
16:59:37.360293 IP bpc063.isi.deterlab.net.http > bpc036.isi.deterlab.net.59490: tcp 0
16:59:38.388624 IP bpc036.isi.deterlab.net.59492 > bpc063.isi.deterlab.net.http: tcp 0
16:59:38.388767 IP bpc063.isi.deterlab.net.http > bpc036.isi.deterlab.net.59492: tcp 0
16:59:39.433718 IP bpc036.isi.deterlab.net.59494 > bpc063.isi.deterlab.net.http: tcp 0
16:59:39.433872 IP bpc063.isi.deterlab.net.http > bpc036.isi.deterlab.net.59494: tcp 0
