16:56:39.331933 IP bpc036.isi.deterlab.net.59146 > bpc063.isi.deterlab.net.http: tcp 0
16:56:39.332090 IP bpc063.isi.deterlab.net.http > bpc036.isi.deterlab.net.59146: tcp 0
16:56:40.360274 IP bpc036.isi.deterlab.net.59148 > bpc063.isi.deterlab.net.http: tcp 0
16:56:40.360421 IP bpc063.isi.deterlab.net.http > bpc036.isi.deterlab.net.59148: tcp 0
16:56:41.388224 IP bpc036.isi.deterlab.net.59150 > bpc063.isi.deterlab.net.http: tcp 0
16:56:41.388352 IP bpc063.isi.deterlab.net.http > bpc036.isi.deterlab.net.59150: tcp 0
16:56:42.434038 IP bpc036.isi.deterlab.net.59152 > bpc063.isi.deterlab.net.http: tcp 0
16:56:42.434107 IP bpc063.isi.deterlab.net.http > bpc036.isi.deterlab.net.59152: tcp 0
16:56:43.462478 IP bpc036.isi.deterlab.net.59154 > bpc063.isi.deterlab.net.http: tcp 0
16:56:43.462634 IP bpc063.isi.deterlab.net.http > bpc036.isi.deterlab.net.59154: tcp 0
16:56:44.506676 IP bpc036.isi.deterlab.net.59156 > bpc063.isi.deterlab.net.http: tcp 0
16:56:44.506789 IP bpc063.isi.deterlab.net.http > bpc036.isi.deterlab.net.59156: tcp 0
16:56:45.550985 IP bpc036.isi.deterlab.net.59158 > bpc063.isi.deterlab.net.http: tcp 0
16:56:45.551094 IP bpc063.isi.deterlab.net.http > bpc036.isi.deterlab.net.59158: tcp 0
16:56:46.579417 IP bpc036.isi.deterlab.net.59160 > bpc063.isi.deterlab.net.http: tcp 0
16:56:46.579573 IP bpc063.isi.deterlab.net.http > bpc036.isi.deterlab.net.59160: tcp 0
16:56:47.607504 IP bpc036.isi.deterlab.net.59162 > bpc063.isi.deterlab.net.http: tcp 0
16:56:47.607603 IP bpc063.isi.deterlab.net.http > bpc036.isi.deterlab.net.59162: tcp 0
16:56:48.635680 IP bpc036.isi.deterlab.net.59164 > bpc063.isi.deterlab.net.http: tcp 0
16:56:48.635785 IP bpc063.isi.deterlab.net.http > bpc036.isi.deterlab.net.59164: tcp 0
16:56:49.663588 IP bpc036.isi.deterlab.net.59166 > bpc063.isi.deterlab.net.http: tcp 0
16:56:49.663715 IP bpc063.isi.deterlab.net.http > bpc036.isi.deterlab.net.59166: tcp 0
16:56:50.707782 IP bpc036.isi.deterlab.net.59168 > bpc063.isi.deterlab.net.http: tcp 0
16:56:50.707921 IP bpc063.isi.deterlab.net.http > bpc036.isi.deterlab.net.59168: tcp 0
16:56:51.736454 IP bpc036.isi.deterlab.net.59170 > bpc063.isi.deterlab.net.http: tcp 0
16:56:51.736604 IP bpc063.isi.deterlab.net.http > bpc036.isi.deterlab.net.59170: tcp 0
16:56:52.780759 IP bpc036.isi.deterlab.net.59172 > bpc063.isi.deterlab.net.http: tcp 0
16:56:52.780839 IP bpc063.isi.deterlab.net.http > bpc036.isi.deterlab.net.59172: tcp 0
16:56:53.825100 IP bpc036.isi.deterlab.net.59174 > bpc063.isi.deterlab.net.http: tcp 0
16:56:53.825240 IP bpc063.isi.deterlab.net.http > bpc036.isi.deterlab.net.59174: tcp 0
16:56:54.869400 IP bpc036.isi.deterlab.net.59176 > bpc063.isi.deterlab.net.http: tcp 0
16:56:54.869544 IP bpc063.isi.deterlab.net.http > bpc036.isi.deterlab.net.59176: tcp 0
16:56:55.897621 IP bpc036.isi.deterlab.net.59178 > bpc063.isi.deterlab.net.http: tcp 0
16:56:55.897775 IP bpc063.isi.deterlab.net.http > bpc036.isi.deterlab.net.59178: tcp 0
16:56:56.942015 IP bpc036.isi.deterlab.net.59180 > bpc063.isi.deterlab.net.http: tcp 0
16:56:56.942130 IP bpc063.isi.deterlab.net.http > bpc036.isi.deterlab.net.59180: tcp 0
16:56:57.970102 IP bpc036.isi.deterlab.net.59182 > bpc063.isi.deterlab.net.http: tcp 0
16:56:57.970260 IP bpc063.isi.deterlab.net.http > bpc036.isi.deterlab.net.59182: tcp 0
16:56:59.015565 IP bpc036.isi.deterlab.net.59184 > bpc063.isi.deterlab.net.http: tcp 0
16:56:59.015714 IP bpc063.isi.deterlab.net.http > bpc036.isi.deterlab.net.59184: tcp 0
16:57:00.059981 IP bpc036.isi.deterlab.net.59186 > bpc063.isi.deterlab.net.http: tcp 0
16:57:00.060118 IP bpc063.isi.deterlab.net.http > bpc036.isi.deterlab.net.59186: tcp 0
16:57:01.088073 IP bpc036.isi.deterlab.net.59188 > bpc063.isi.deterlab.net.http: tcp 0
16:57:01.088248 IP bpc063.isi.deterlab.net.http > bpc036.isi.deterlab.net.59188: tcp 0
16:57:02.117817 IP bpc036.isi.deterlab.net.59190 > bpc063.isi.deterlab.net.http: tcp 0
16:57:02.117926 IP bpc063.isi.deterlab.net.http > bpc036.isi.deterlab.net.59190: tcp 0
16:57:03.160893 IP bpc036.isi.deterlab.net.59192 > bpc063.isi.deterlab.net.http: tcp 0
16:57:03.161288 IP bpc063.isi.deterlab.net.http > bpc036.isi.deterlab.net.59192: tcp 0
16:57:04.190353 IP bpc036.isi.deterlab.net.59194 > bpc063.isi.deterlab.net.http: tcp 0
16:57:04.190501 IP bpc063.isi.deterlab.net.http > bpc036.isi.deterlab.net.59194: tcp 0
16:57:05.219491 IP bpc036.isi.deterlab.net.59196 > bpc063.isi.deterlab.net.http: tcp 0
16:57:05.219630 IP bpc063.isi.deterlab.net.http > bpc036.isi.deterlab.net.59196: tcp 0
16:57:06.248939 IP bpc036.isi.deterlab.net.59198 > bpc063.isi.deterlab.net.http: tcp 0
16:57:06.249109 IP bpc063.isi.deterlab.net.http > bpc036.isi.deterlab.net.59198: tcp 0
16:57:07.293643 IP bpc036.isi.deterlab.net.59200 > bpc063.isi.deterlab.net.http: tcp 0
16:57:07.293719 IP bpc063.isi.deterlab.net.http > bpc036.isi.deterlab.net.59200: tcp 0
16:57:08.322129 IP bpc036.isi.deterlab.net.59202 > bpc063.isi.deterlab.net.http: tcp 0
16:57:08.322293 IP bpc063.isi.deterlab.net.http > bpc036.isi.deterlab.net.59202: tcp 0
16:57:09.352606 IP bpc036.isi.deterlab.net.59204 > bpc063.isi.deterlab.net.http: tcp 0
16:57:09.352720 IP bpc063.isi.deterlab.net.http > bpc036.isi.deterlab.net.59204: tcp 0
16:57:10.383435 IP bpc036.isi.deterlab.net.59206 > bpc063.isi.deterlab.net.http: tcp 0
16:57:10.383547 IP bpc063.isi.deterlab.net.http > bpc036.isi.deterlab.net.59206: tcp 0
16:57:11.414611 IP bpc036.isi.deterlab.net.59208 > bpc063.isi.deterlab.net.http: tcp 0
16:57:11.414830 IP bpc063.isi.deterlab.net.http > bpc036.isi.deterlab.net.59208: tcp 0
16:57:12.459402 IP bpc036.isi.deterlab.net.59210 > bpc063.isi.deterlab.net.http: tcp 0
16:57:12.459485 IP bpc063.isi.deterlab.net.http > bpc036.isi.deterlab.net.59210: tcp 0
16:57:13.503738 IP bpc036.isi.deterlab.net.59212 > bpc063.isi.deterlab.net.http: tcp 0
16:57:13.503835 IP bpc063.isi.deterlab.net.http > bpc036.isi.deterlab.net.59212: tcp 0
16:57:14.549818 IP bpc036.isi.deterlab.net.59214 > bpc063.isi.deterlab.net.http: tcp 0
16:57:14.549938 IP bpc063.isi.deterlab.net.http > bpc036.isi.deterlab.net.59214: tcp 0
16:57:15.594110 IP bpc036.isi.deterlab.net.59216 > bpc063.isi.deterlab.net.http: tcp 0
16:57:15.594242 IP bpc063.isi.deterlab.net.http > bpc036.isi.deterlab.net.59216: tcp 0
16:57:16.639538 IP bpc036.isi.deterlab.net.59218 > bpc063.isi.deterlab.net.http: tcp 0
16:57:16.639645 IP bpc063.isi.deterlab.net.http > bpc036.isi.deterlab.net.59218: tcp 0
16:57:17.668149 IP bpc036.isi.deterlab.net.59220 > bpc063.isi.deterlab.net.http: tcp 0
16:57:17.668225 IP bpc063.isi.deterlab.net.http > bpc036.isi.deterlab.net.59220: tcp 0
16:57:18.713672 IP bpc036.isi.deterlab.net.59222 > bpc063.isi.deterlab.net.http: tcp 0
16:57:18.713779 IP bpc063.isi.deterlab.net.http > bpc036.isi.deterlab.net.59222: tcp 0
16:57:19.757834 IP bpc036.isi.deterlab.net.59224 > bpc063.isi.deterlab.net.http: tcp 0
16:57:19.757983 IP bpc063.isi.deterlab.net.http > bpc036.isi.deterlab.net.59224: tcp 0
16:57:20.802239 IP bpc036.isi.deterlab.net.59226 > bpc063.isi.deterlab.net.http: tcp 0
16:57:20.802338 IP bpc063.isi.deterlab.net.http > bpc036.isi.deterlab.net.59226: tcp 0
16:57:21.846522 IP bpc036.isi.deterlab.net.59228 > bpc063.isi.deterlab.net.http: tcp 0
16:57:21.846643 IP bpc063.isi.deterlab.net.http > bpc036.isi.deterlab.net.59228: tcp 0
16:57:22.890625 IP bpc036.isi.deterlab.net.59230 > bpc063.isi.deterlab.net.http: tcp 0
16:57:22.890720 IP bpc063.isi.deterlab.net.http > bpc036.isi.deterlab.net.59230: tcp 0
16:57:23.934919 IP bpc036.isi.deterlab.net.59232 > bpc063.isi.deterlab.net.http: tcp 0
16:57:23.935075 IP bpc063.isi.deterlab.net.http > bpc036.isi.deterlab.net.59232: tcp 0
16:57:24.979240 IP bpc036.isi.deterlab.net.59234 > bpc063.isi.deterlab.net.http: tcp 0
16:57:24.979380 IP bpc063.isi.deterlab.net.http > bpc036.isi.deterlab.net.59234: tcp 0
16:57:26.007418 IP bpc036.isi.deterlab.net.59236 > bpc063.isi.deterlab.net.http: tcp 0
16:57:26.007561 IP bpc063.isi.deterlab.net.http > bpc036.isi.deterlab.net.59236: tcp 0
16:57:27.036501 IP bpc036.isi.deterlab.net.59238 > bpc063.isi.deterlab.net.http: tcp 0
16:57:27.036600 IP bpc063.isi.deterlab.net.http > bpc036.isi.deterlab.net.59238: tcp 0
16:57:28.080777 IP bpc036.isi.deterlab.net.59240 > bpc063.isi.deterlab.net.http: tcp 0
16:57:28.080878 IP bpc063.isi.deterlab.net.http > bpc036.isi.deterlab.net.59240: tcp 0
16:57:29.126403 IP bpc036.isi.deterlab.net.59242 > bpc063.isi.deterlab.net.http: tcp 0
16:57:29.126483 IP bpc063.isi.deterlab.net.http > bpc036.isi.deterlab.net.59242: tcp 0
16:57:30.154578 IP bpc036.isi.deterlab.net.59244 > bpc063.isi.deterlab.net.http: tcp 0
16:57:30.154708 IP bpc063.isi.deterlab.net.http > bpc036.isi.deterlab.net.59244: tcp 0
16:57:31.184426 IP bpc036.isi.deterlab.net.59246 > bpc063.isi.deterlab.net.http: tcp 0
16:57:31.184537 IP bpc063.isi.deterlab.net.http > bpc036.isi.deterlab.net.59246: tcp 0
16:57:32.228744 IP bpc036.isi.deterlab.net.59248 > bpc063.isi.deterlab.net.http: tcp 0
16:57:32.228849 IP bpc063.isi.deterlab.net.http > bpc036.isi.deterlab.net.59248: tcp 0
16:57:33.271218 IP bpc036.isi.deterlab.net.59250 > bpc063.isi.deterlab.net.http: tcp 0
16:57:33.271351 IP bpc063.isi.deterlab.net.http > bpc036.isi.deterlab.net.59250: tcp 0
16:57:34.300605 IP bpc036.isi.deterlab.net.59252 > bpc063.isi.deterlab.net.http: tcp 0
16:57:34.300730 IP bpc063.isi.deterlab.net.http > bpc036.isi.deterlab.net.59252: tcp 0
16:57:35.330267 IP bpc036.isi.deterlab.net.59254 > bpc063.isi.deterlab.net.http: tcp 0
16:57:35.330409 IP bpc063.isi.deterlab.net.http > bpc036.isi.deterlab.net.59254: tcp 0
16:57:36.375276 IP bpc036.isi.deterlab.net.59256 > bpc063.isi.deterlab.net.http: tcp 0
16:57:36.375364 IP bpc063.isi.deterlab.net.http > bpc036.isi.deterlab.net.59256: tcp 0
16:57:37.404969 IP bpc036.isi.deterlab.net.59258 > bpc063.isi.deterlab.net.http: tcp 0
16:57:37.405048 IP bpc063.isi.deterlab.net.http > bpc036.isi.deterlab.net.59258: tcp 0
16:57:38.435113 IP bpc036.isi.deterlab.net.59260 > bpc063.isi.deterlab.net.http: tcp 0
16:57:38.435220 IP bpc063.isi.deterlab.net.http > bpc036.isi.deterlab.net.59260: tcp 0
16:57:39.465337 IP bpc036.isi.deterlab.net.59262 > bpc063.isi.deterlab.net.http: tcp 0
16:57:39.465447 IP bpc063.isi.deterlab.net.http > bpc036.isi.deterlab.net.59262: tcp 0
16:57:40.494412 IP bpc036.isi.deterlab.net.59264 > bpc063.isi.deterlab.net.http: tcp 0
16:57:40.494526 IP bpc063.isi.deterlab.net.http > bpc036.isi.deterlab.net.59264: tcp 0
16:57:41.523267 IP bpc036.isi.deterlab.net.59266 > bpc063.isi.deterlab.net.http: tcp 0
16:57:41.523407 IP bpc063.isi.deterlab.net.http > bpc036.isi.deterlab.net.59266: tcp 0
16:57:42.553906 IP bpc036.isi.deterlab.net.59268 > bpc063.isi.deterlab.net.http: tcp 0
16:57:42.553999 IP bpc063.isi.deterlab.net.http > bpc036.isi.deterlab.net.59268: tcp 0
16:57:43.584145 IP bpc036.isi.deterlab.net.59270 > bpc063.isi.deterlab.net.http: tcp 0
16:57:43.584277 IP bpc063.isi.deterlab.net.http > bpc036.isi.deterlab.net.59270: tcp 0
16:57:44.612555 IP bpc036.isi.deterlab.net.59272 > bpc063.isi.deterlab.net.http: tcp 0
16:57:44.612659 IP bpc063.isi.deterlab.net.http > bpc036.isi.deterlab.net.59272: tcp 0
16:57:45.645423 IP bpc036.isi.deterlab.net.59274 > bpc063.isi.deterlab.net.http: tcp 0
16:57:45.645533 IP bpc063.isi.deterlab.net.http > bpc036.isi.deterlab.net.59274: tcp 0
16:57:46.674800 IP bpc036.isi.deterlab.net.59276 > bpc063.isi.deterlab.net.http: tcp 0
16:57:46.674911 IP bpc063.isi.deterlab.net.http > bpc036.isi.deterlab.net.59276: tcp 0
16:57:47.703998 IP bpc036.isi.deterlab.net.59278 > bpc063.isi.deterlab.net.http: tcp 0
16:57:47.704091 IP bpc063.isi.deterlab.net.http > bpc036.isi.deterlab.net.59278: tcp 0
16:57:48.733888 IP bpc036.isi.deterlab.net.59280 > bpc063.isi.deterlab.net.http: tcp 0
16:57:48.734022 IP bpc063.isi.deterlab.net.http > bpc036.isi.deterlab.net.59280: tcp 0
16:57:49.762592 IP bpc036.isi.deterlab.net.59282 > bpc063.isi.deterlab.net.http: tcp 0
16:57:49.762701 IP bpc063.isi.deterlab.net.http > bpc036.isi.deterlab.net.59282: tcp 0
16:57:50.790858 IP bpc036.isi.deterlab.net.59284 > bpc063.isi.deterlab.net.http: tcp 0
16:57:50.790932 IP bpc063.isi.deterlab.net.http > bpc036.isi.deterlab.net.59284: tcp 0
16:57:51.835189 IP bpc036.isi.deterlab.net.59286 > bpc063.isi.deterlab.net.http: tcp 0
16:57:51.835288 IP bpc063.isi.deterlab.net.http > bpc036.isi.deterlab.net.59286: tcp 0
16:57:52.865279 IP bpc036.isi.deterlab.net.59288 > bpc063.isi.deterlab.net.http: tcp 0
16:57:52.865416 IP bpc063.isi.deterlab.net.http > bpc036.isi.deterlab.net.59288: tcp 0
16:57:53.910142 IP bpc036.isi.deterlab.net.59290 > bpc063.isi.deterlab.net.http: tcp 0
16:57:53.910221 IP bpc063.isi.deterlab.net.http > bpc036.isi.deterlab.net.59290: tcp 0
16:57:54.939476 IP bpc036.isi.deterlab.net.59292 > bpc063.isi.deterlab.net.http: tcp 0
16:57:54.939600 IP bpc063.isi.deterlab.net.http > bpc036.isi.deterlab.net.59292: tcp 0
16:57:55.968887 IP bpc036.isi.deterlab.net.59294 > bpc063.isi.deterlab.net.http: tcp 0
16:57:55.968980 IP bpc063.isi.deterlab.net.http > bpc036.isi.deterlab.net.59294: tcp 0
16:57:56.997877 IP bpc036.isi.deterlab.net.59296 > bpc063.isi.deterlab.net.http: tcp 0
16:57:56.998009 IP bpc063.isi.deterlab.net.http > bpc036.isi.deterlab.net.59296: tcp 0
16:57:58.026824 IP bpc036.isi.deterlab.net.59298 > bpc063.isi.deterlab.net.http: tcp 0
16:57:58.026930 IP bpc063.isi.deterlab.net.http > bpc036.isi.deterlab.net.59298: tcp 0
16:57:59.055620 IP bpc036.isi.deterlab.net.59300 > bpc063.isi.deterlab.net.http: tcp 0
16:57:59.055760 IP bpc063.isi.deterlab.net.http > bpc036.isi.deterlab.net.59300: tcp 0
16:58:00.084634 IP bpc036.isi.deterlab.net.59302 > bpc063.isi.deterlab.net.http: tcp 0
16:58:00.084741 IP bpc063.isi.deterlab.net.http > bpc036.isi.deterlab.net.59302: tcp 0
16:58:01.113557 IP bpc036.isi.deterlab.net.59304 > bpc063.isi.deterlab.net.http: tcp 0
16:58:01.113626 IP bpc063.isi.deterlab.net.http > bpc036.isi.deterlab.net.59304: tcp 0
16:58:02.142087 IP bpc036.isi.deterlab.net.59306 > bpc063.isi.deterlab.net.http: tcp 0
16:58:02.142206 IP bpc063.isi.deterlab.net.http > bpc036.isi.deterlab.net.59306: tcp 0
16:58:03.173199 IP bpc036.isi.deterlab.net.59308 > bpc063.isi.deterlab.net.http: tcp 0
16:58:03.173307 IP bpc063.isi.deterlab.net.http > bpc036.isi.deterlab.net.59308: tcp 0
16:58:04.202235 IP bpc036.isi.deterlab.net.59310 > bpc063.isi.deterlab.net.http: tcp 0
16:58:04.202337 IP bpc063.isi.deterlab.net.http > bpc036.isi.deterlab.net.59310: tcp 0
16:58:05.231688 IP bpc036.isi.deterlab.net.59312 > bpc063.isi.deterlab.net.http: tcp 0
16:58:05.231817 IP bpc063.isi.deterlab.net.http > bpc036.isi.deterlab.net.59312: tcp 0
16:58:06.261381 IP bpc036.isi.deterlab.net.59314 > bpc063.isi.deterlab.net.http: tcp 0
16:58:06.261496 IP bpc063.isi.deterlab.net.http > bpc036.isi.deterlab.net.59314: tcp 0
16:58:07.290319 IP bpc036.isi.deterlab.net.59316 > bpc063.isi.deterlab.net.http: tcp 0
16:58:07.290426 IP bpc063.isi.deterlab.net.http > bpc036.isi.deterlab.net.59316: tcp 0
16:58:08.334844 IP bpc036.isi.deterlab.net.59318 > bpc063.isi.deterlab.net.http: tcp 0
16:58:08.334981 IP bpc063.isi.deterlab.net.http > bpc036.isi.deterlab.net.59318: tcp 0
16:58:09.380915 IP bpc036.isi.deterlab.net.59320 > bpc063.isi.deterlab.net.http: tcp 0
16:58:09.381035 IP bpc063.isi.deterlab.net.http > bpc036.isi.deterlab.net.59320: tcp 0
16:58:10.409188 IP bpc036.isi.deterlab.net.59322 > bpc063.isi.deterlab.net.http: tcp 0
16:58:10.409268 IP bpc063.isi.deterlab.net.http > bpc036.isi.deterlab.net.59322: tcp 0
16:58:11.453650 IP bpc036.isi.deterlab.net.59324 > bpc063.isi.deterlab.net.http: tcp 0
16:58:11.453771 IP bpc063.isi.deterlab.net.http > bpc036.isi.deterlab.net.59324: tcp 0
16:58:12.482426 IP bpc036.isi.deterlab.net.59326 > bpc063.isi.deterlab.net.http: tcp 0
16:58:12.482551 IP bpc063.isi.deterlab.net.http > bpc036.isi.deterlab.net.59326: tcp 0
16:58:13.512434 IP bpc036.isi.deterlab.net.59328 > bpc063.isi.deterlab.net.http: tcp 0
16:58:13.512530 IP bpc063.isi.deterlab.net.http > bpc036.isi.deterlab.net.59328: tcp 0
16:58:14.542022 IP bpc036.isi.deterlab.net.59330 > bpc063.isi.deterlab.net.http: tcp 0
16:58:14.542159 IP bpc063.isi.deterlab.net.http > bpc036.isi.deterlab.net.59330: tcp 0
16:58:15.571313 IP bpc036.isi.deterlab.net.59332 > bpc063.isi.deterlab.net.http: tcp 0
16:58:15.571440 IP bpc063.isi.deterlab.net.http > bpc036.isi.deterlab.net.59332: tcp 0
16:58:16.600282 IP bpc036.isi.deterlab.net.59334 > bpc063.isi.deterlab.net.http: tcp 0
16:58:16.600370 IP bpc063.isi.deterlab.net.http > bpc036.isi.deterlab.net.59334: tcp 0
16:58:17.629240 IP bpc036.isi.deterlab.net.59336 > bpc063.isi.deterlab.net.http: tcp 0
16:58:17.629351 IP bpc063.isi.deterlab.net.http > bpc036.isi.deterlab.net.59336: tcp 0
16:58:18.660902 IP bpc036.isi.deterlab.net.59338 > bpc063.isi.deterlab.net.http: tcp 0
16:58:18.661027 IP bpc063.isi.deterlab.net.http > bpc036.isi.deterlab.net.59338: tcp 0
16:58:19.690370 IP bpc036.isi.deterlab.net.59340 > bpc063.isi.deterlab.net.http: tcp 0
16:58:19.690457 IP bpc063.isi.deterlab.net.http > bpc036.isi.deterlab.net.59340: tcp 0
16:58:20.719485 IP bpc036.isi.deterlab.net.59342 > bpc063.isi.deterlab.net.http: tcp 0
16:58:20.719587 IP bpc063.isi.deterlab.net.http > bpc036.isi.deterlab.net.59342: tcp 0
16:58:21.748171 IP bpc036.isi.deterlab.net.59344 > bpc063.isi.deterlab.net.http: tcp 0
16:58:21.748268 IP bpc063.isi.deterlab.net.http > bpc036.isi.deterlab.net.59344: tcp 0
16:58:22.777027 IP bpc036.isi.deterlab.net.59346 > bpc063.isi.deterlab.net.http: tcp 0
16:58:22.777148 IP bpc063.isi.deterlab.net.http > bpc036.isi.deterlab.net.59346: tcp 0
16:58:23.805707 IP bpc036.isi.deterlab.net.59348 > bpc063.isi.deterlab.net.http: tcp 0
16:58:23.805828 IP bpc063.isi.deterlab.net.http > bpc036.isi.deterlab.net.59348: tcp 0
16:58:24.834610 IP bpc036.isi.deterlab.net.59350 > bpc063.isi.deterlab.net.http: tcp 0
16:58:24.834710 IP bpc063.isi.deterlab.net.http > bpc036.isi.deterlab.net.59350: tcp 0
16:58:25.863536 IP bpc036.isi.deterlab.net.59352 > bpc063.isi.deterlab.net.http: tcp 0
16:58:25.863690 IP bpc063.isi.deterlab.net.http > bpc036.isi.deterlab.net.59352: tcp 0
16:58:26.894719 IP bpc036.isi.deterlab.net.59354 > bpc063.isi.deterlab.net.http: tcp 0
16:58:26.894818 IP bpc063.isi.deterlab.net.http > bpc036.isi.deterlab.net.59354: tcp 0
16:58:27.923721 IP bpc036.isi.deterlab.net.59356 > bpc063.isi.deterlab.net.http: tcp 0
16:58:27.923798 IP bpc063.isi.deterlab.net.http > bpc036.isi.deterlab.net.59356: tcp 0
16:58:29.066997 IP bpc036.isi.deterlab.net.59358 > bpc063.isi.deterlab.net.http: tcp 0
16:58:29.067093 IP bpc063.isi.deterlab.net.http > bpc036.isi.deterlab.net.59358: tcp 0
16:58:30.095904 IP bpc036.isi.deterlab.net.59360 > bpc063.isi.deterlab.net.http: tcp 0
16:58:30.095976 IP bpc063.isi.deterlab.net.http > bpc036.isi.deterlab.net.59360: tcp 0
16:58:31.124794 IP bpc036.isi.deterlab.net.59362 > bpc063.isi.deterlab.net.http: tcp 0
16:58:31.124905 IP bpc063.isi.deterlab.net.http > bpc036.isi.deterlab.net.59362: tcp 0
16:58:32.153370 IP bpc036.isi.deterlab.net.59364 > bpc063.isi.deterlab.net.http: tcp 0
16:58:32.153485 IP bpc063.isi.deterlab.net.http > bpc036.isi.deterlab.net.59364: tcp 0
16:58:33.197888 IP bpc036.isi.deterlab.net.59366 > bpc063.isi.deterlab.net.http: tcp 0
16:58:33.197992 IP bpc063.isi.deterlab.net.http > bpc036.isi.deterlab.net.59366: tcp 0
16:58:34.240350 IP bpc036.isi.deterlab.net.59368 > bpc063.isi.deterlab.net.http: tcp 0
16:58:34.240451 IP bpc063.isi.deterlab.net.http > bpc036.isi.deterlab.net.59368: tcp 0
16:58:35.269208 IP bpc036.isi.deterlab.net.59370 > bpc063.isi.deterlab.net.http: tcp 0
16:58:35.269330 IP bpc063.isi.deterlab.net.http > bpc036.isi.deterlab.net.59370: tcp 0
16:58:36.313637 IP bpc036.isi.deterlab.net.59372 > bpc063.isi.deterlab.net.http: tcp 0
16:58:36.313786 IP bpc063.isi.deterlab.net.http > bpc036.isi.deterlab.net.59372: tcp 0
16:58:37.358177 IP bpc036.isi.deterlab.net.59374 > bpc063.isi.deterlab.net.http: tcp 0
16:58:37.358331 IP bpc063.isi.deterlab.net.http > bpc036.isi.deterlab.net.59374: tcp 0
16:58:38.402365 IP bpc036.isi.deterlab.net.59376 > bpc063.isi.deterlab.net.http: tcp 0
16:58:38.402487 IP bpc063.isi.deterlab.net.http > bpc036.isi.deterlab.net.59376: tcp 0
16:58:39.446523 IP bpc036.isi.deterlab.net.59378 > bpc063.isi.deterlab.net.http: tcp 0
16:58:39.446597 IP bpc063.isi.deterlab.net.http > bpc036.isi.deterlab.net.59378: tcp 0
16:58:40.490766 IP bpc036.isi.deterlab.net.59380 > bpc063.isi.deterlab.net.http: tcp 0
16:58:40.490899 IP bpc063.isi.deterlab.net.http > bpc036.isi.deterlab.net.59380: tcp 0
16:58:41.535081 IP bpc036.isi.deterlab.net.59382 > bpc063.isi.deterlab.net.http: tcp 0
16:58:41.535204 IP bpc063.isi.deterlab.net.http > bpc036.isi.deterlab.net.59382: tcp 0
16:58:42.580764 IP bpc036.isi.deterlab.net.59384 > bpc063.isi.deterlab.net.http: tcp 0
16:58:42.580858 IP bpc063.isi.deterlab.net.http > bpc036.isi.deterlab.net.59384: tcp 0
16:58:43.625141 IP bpc036.isi.deterlab.net.59386 > bpc063.isi.deterlab.net.http: tcp 0
16:58:43.625264 IP bpc063.isi.deterlab.net.http > bpc036.isi.deterlab.net.59386: tcp 0
16:58:44.654998 IP bpc036.isi.deterlab.net.59388 > bpc063.isi.deterlab.net.http: tcp 0
16:58:44.655142 IP bpc063.isi.deterlab.net.http > bpc036.isi.deterlab.net.59388: tcp 0
16:58:45.684024 IP bpc036.isi.deterlab.net.59390 > bpc063.isi.deterlab.net.http: tcp 0
16:58:45.684123 IP bpc063.isi.deterlab.net.http > bpc036.isi.deterlab.net.59390: tcp 0
16:58:46.728475 IP bpc036.isi.deterlab.net.59392 > bpc063.isi.deterlab.net.http: tcp 0
16:58:46.728579 IP bpc063.isi.deterlab.net.http > bpc036.isi.deterlab.net.59392: tcp 0
16:58:47.758285 IP bpc036.isi.deterlab.net.59394 > bpc063.isi.deterlab.net.http: tcp 0
16:58:47.758407 IP bpc063.isi.deterlab.net.http > bpc036.isi.deterlab.net.59394: tcp 0
16:58:48.802589 IP bpc036.isi.deterlab.net.59396 > bpc063.isi.deterlab.net.http: tcp 0
16:58:48.802714 IP bpc063.isi.deterlab.net.http > bpc036.isi.deterlab.net.59396: tcp 0
16:58:49.846914 IP bpc036.isi.deterlab.net.59398 > bpc063.isi.deterlab.net.http: tcp 0
16:58:49.847070 IP bpc063.isi.deterlab.net.http > bpc036.isi.deterlab.net.59398: tcp 0
16:58:50.891231 IP bpc036.isi.deterlab.net.59400 > bpc063.isi.deterlab.net.http: tcp 0
16:58:50.891326 IP bpc063.isi.deterlab.net.http > bpc036.isi.deterlab.net.59400: tcp 0
16:58:51.935391 IP bpc036.isi.deterlab.net.59402 > bpc063.isi.deterlab.net.http: tcp 0
16:58:51.935532 IP bpc063.isi.deterlab.net.http > bpc036.isi.deterlab.net.59402: tcp 0
16:58:52.965605 IP bpc036.isi.deterlab.net.59404 > bpc063.isi.deterlab.net.http: tcp 0
16:58:52.965710 IP bpc063.isi.deterlab.net.http > bpc036.isi.deterlab.net.59404: tcp 0
16:58:54.009948 IP bpc036.isi.deterlab.net.59406 > bpc063.isi.deterlab.net.http: tcp 0
16:58:54.010067 IP bpc063.isi.deterlab.net.http > bpc036.isi.deterlab.net.59406: tcp 0
16:58:55.038345 IP bpc036.isi.deterlab.net.59408 > bpc063.isi.deterlab.net.http: tcp 0
16:58:55.038448 IP bpc063.isi.deterlab.net.http > bpc036.isi.deterlab.net.59408: tcp 0
16:58:56.066461 IP bpc036.isi.deterlab.net.59410 > bpc063.isi.deterlab.net.http: tcp 0
16:58:56.066534 IP bpc063.isi.deterlab.net.http > bpc036.isi.deterlab.net.59410: tcp 0
16:58:57.110733 IP bpc036.isi.deterlab.net.59412 > bpc063.isi.deterlab.net.http: tcp 0
16:58:57.110837 IP bpc063.isi.deterlab.net.http > bpc036.isi.deterlab.net.59412: tcp 0
16:58:58.138830 IP bpc036.isi.deterlab.net.59414 > bpc063.isi.deterlab.net.http: tcp 0
16:58:58.138919 IP bpc063.isi.deterlab.net.http > bpc036.isi.deterlab.net.59414: tcp 0
16:58:59.183093 IP bpc036.isi.deterlab.net.59416 > bpc063.isi.deterlab.net.http: tcp 0
16:58:59.183225 IP bpc063.isi.deterlab.net.http > bpc036.isi.deterlab.net.59416: tcp 0
16:59:00.211304 IP bpc036.isi.deterlab.net.59418 > bpc063.isi.deterlab.net.http: tcp 0
16:59:00.211457 IP bpc063.isi.deterlab.net.http > bpc036.isi.deterlab.net.59418: tcp 0
16:59:01.240796 IP bpc036.isi.deterlab.net.59420 > bpc063.isi.deterlab.net.http: tcp 0
16:59:01.240888 IP bpc063.isi.deterlab.net.http > bpc036.isi.deterlab.net.59420: tcp 0
16:59:02.284992 IP bpc036.isi.deterlab.net.59422 > bpc063.isi.deterlab.net.http: tcp 0
16:59:02.285144 IP bpc063.isi.deterlab.net.http > bpc036.isi.deterlab.net.59422: tcp 0
16:59:03.329347 IP bpc036.isi.deterlab.net.59424 > bpc063.isi.deterlab.net.http: tcp 0
16:59:03.329450 IP bpc063.isi.deterlab.net.http > bpc036.isi.deterlab.net.59424: tcp 0
16:59:04.361726 IP bpc036.isi.deterlab.net.59426 > bpc063.isi.deterlab.net.http: tcp 0
16:59:04.361826 IP bpc063.isi.deterlab.net.http > bpc036.isi.deterlab.net.59426: tcp 0
16:59:05.391395 IP bpc036.isi.deterlab.net.59428 > bpc063.isi.deterlab.net.http: tcp 0
16:59:05.391505 IP bpc063.isi.deterlab.net.http > bpc036.isi.deterlab.net.59428: tcp 0
16:59:06.420292 IP bpc036.isi.deterlab.net.59430 > bpc063.isi.deterlab.net.http: tcp 0
16:59:06.420386 IP bpc063.isi.deterlab.net.http > bpc036.isi.deterlab.net.59430: tcp 0
16:59:07.449288 IP bpc036.isi.deterlab.net.59432 > bpc063.isi.deterlab.net.http: tcp 0
16:59:07.449435 IP bpc063.isi.deterlab.net.http > bpc036.isi.deterlab.net.59432: tcp 0
16:59:08.494250 IP bpc036.isi.deterlab.net.59434 > bpc063.isi.deterlab.net.http: tcp 0
16:59:08.494391 IP bpc063.isi.deterlab.net.http > bpc036.isi.deterlab.net.59434: tcp 0
16:59:09.522740 IP bpc036.isi.deterlab.net.59436 > bpc063.isi.deterlab.net.http: tcp 0
16:59:09.522822 IP bpc063.isi.deterlab.net.http > bpc036.isi.deterlab.net.59436: tcp 0
16:59:10.551137 IP bpc036.isi.deterlab.net.59438 > bpc063.isi.deterlab.net.http: tcp 0
16:59:10.551254 IP bpc063.isi.deterlab.net.http > bpc036.isi.deterlab.net.59438: tcp 0
16:59:11.595932 IP bpc036.isi.deterlab.net.59440 > bpc063.isi.deterlab.net.http: tcp 0
16:59:11.596111 IP bpc063.isi.deterlab.net.http > bpc036.isi.deterlab.net.59440: tcp 0
16:59:12.626192 IP bpc036.isi.deterlab.net.59442 > bpc063.isi.deterlab.net.http: tcp 0
16:59:12.626337 IP bpc063.isi.deterlab.net.http > bpc036.isi.deterlab.net.59442: tcp 0
16:59:13.656735 IP bpc036.isi.deterlab.net.59444 > bpc063.isi.deterlab.net.http: tcp 0
16:59:13.656925 IP bpc063.isi.deterlab.net.http > bpc036.isi.deterlab.net.59444: tcp 0
16:59:14.687187 IP bpc036.isi.deterlab.net.59446 > bpc063.isi.deterlab.net.http: tcp 0
16:59:14.687331 IP bpc063.isi.deterlab.net.http > bpc036.isi.deterlab.net.59446: tcp 0
16:59:15.716207 IP bpc036.isi.deterlab.net.59448 > bpc063.isi.deterlab.net.http: tcp 0
16:59:15.716363 IP bpc063.isi.deterlab.net.http > bpc036.isi.deterlab.net.59448: tcp 0
16:59:16.745129 IP bpc036.isi.deterlab.net.59450 > bpc063.isi.deterlab.net.http: tcp 0
16:59:16.745294 IP bpc063.isi.deterlab.net.http > bpc036.isi.deterlab.net.59450: tcp 0
16:59:17.773713 IP bpc036.isi.deterlab.net.59452 > bpc063.isi.deterlab.net.http: tcp 0
16:59:17.773875 IP bpc063.isi.deterlab.net.http > bpc036.isi.deterlab.net.59452: tcp 0
16:59:18.802745 IP bpc036.isi.deterlab.net.59454 > bpc063.isi.deterlab.net.http: tcp 0
16:59:18.802857 IP bpc063.isi.deterlab.net.http > bpc036.isi.deterlab.net.59454: tcp 0
16:59:19.831685 IP bpc036.isi.deterlab.net.59456 > bpc063.isi.deterlab.net.http: tcp 0
16:59:19.831887 IP bpc063.isi.deterlab.net.http > bpc036.isi.deterlab.net.59456: tcp 0
16:59:20.860727 IP bpc036.isi.deterlab.net.59458 > bpc063.isi.deterlab.net.http: tcp 0
16:59:20.860819 IP bpc063.isi.deterlab.net.http > bpc036.isi.deterlab.net.59458: tcp 0
16:59:21.889620 IP bpc036.isi.deterlab.net.59460 > bpc063.isi.deterlab.net.http: tcp 0
16:59:21.889801 IP bpc063.isi.deterlab.net.http > bpc036.isi.deterlab.net.59460: tcp 0
16:59:22.918480 IP bpc036.isi.deterlab.net.59462 > bpc063.isi.deterlab.net.http: tcp 0
16:59:22.918581 IP bpc063.isi.deterlab.net.http > bpc036.isi.deterlab.net.59462: tcp 0
16:59:23.947431 IP bpc036.isi.deterlab.net.59464 > bpc063.isi.deterlab.net.http: tcp 0
16:59:23.947563 IP bpc063.isi.deterlab.net.http > bpc036.isi.deterlab.net.59464: tcp 0
16:59:24.976357 IP bpc036.isi.deterlab.net.59466 > bpc063.isi.deterlab.net.http: tcp 0
16:59:24.976493 IP bpc063.isi.deterlab.net.http > bpc036.isi.deterlab.net.59466: tcp 0
16:59:26.005374 IP bpc036.isi.deterlab.net.59468 > bpc063.isi.deterlab.net.http: tcp 0
16:59:26.005526 IP bpc063.isi.deterlab.net.http > bpc036.isi.deterlab.net.59468: tcp 0
16:59:27.034392 IP bpc036.isi.deterlab.net.59470 > bpc063.isi.deterlab.net.http: tcp 0
16:59:27.034506 IP bpc063.isi.deterlab.net.http > bpc036.isi.deterlab.net.59470: tcp 0
16:59:28.063510 IP bpc036.isi.deterlab.net.59472 > bpc063.isi.deterlab.net.http: tcp 0
16:59:28.063628 IP bpc063.isi.deterlab.net.http > bpc036.isi.deterlab.net.59472: tcp 0
16:59:29.092252 IP bpc036.isi.deterlab.net.59474 > bpc063.isi.deterlab.net.http: tcp 0
16:59:29.092360 IP bpc063.isi.deterlab.net.http > bpc036.isi.deterlab.net.59474: tcp 0
16:59:30.122594 IP bpc036.isi.deterlab.net.59476 > bpc063.isi.deterlab.net.http: tcp 0
16:59:30.122797 IP bpc063.isi.deterlab.net.http > bpc036.isi.deterlab.net.59476: tcp 0
16:59:31.151033 IP bpc036.isi.deterlab.net.59478 > bpc063.isi.deterlab.net.http: tcp 0
16:59:31.151175 IP bpc063.isi.deterlab.net.http > bpc036.isi.deterlab.net.59478: tcp 0
16:59:32.181965 IP bpc036.isi.deterlab.net.59480 > bpc063.isi.deterlab.net.http: tcp 0
16:59:32.182052 IP bpc063.isi.deterlab.net.http > bpc036.isi.deterlab.net.59480: tcp 0
16:59:33.210339 IP bpc036.isi.deterlab.net.59482 > bpc063.isi.deterlab.net.http: tcp 0
16:59:33.210484 IP bpc063.isi.deterlab.net.http > bpc036.isi.deterlab.net.59482: tcp 0
16:59:34.266583 IP bpc036.isi.deterlab.net.59484 > bpc063.isi.deterlab.net.http: tcp 0
16:59:34.266722 IP bpc063.isi.deterlab.net.http > bpc036.isi.deterlab.net.59484: tcp 0
16:59:35.298304 IP bpc036.isi.deterlab.net.59486 > bpc063.isi.deterlab.net.http: tcp 0
16:59:35.298447 IP bpc063.isi.deterlab.net.http > bpc036.isi.deterlab.net.59486: tcp 0
16:59:36.328821 IP bpc036.isi.deterlab.net.59488 > bpc063.isi.deterlab.net.http: tcp 0
16:59:36.329129 IP bpc063.isi.deterlab.net.http > bpc036.isi.deterlab.net.59488: tcp 0
16:59:37.358823 IP bpc036.isi.deterlab.net.59490 > bpc063.isi.deterlab.net.http: tcp 0
16:59:37.359048 IP bpc063.isi.deterlab.net.http > bpc036.isi.deterlab.net.59490: tcp 0
16:59:38.387469 IP bpc036.isi.deterlab.net.59492 > bpc063.isi.deterlab.net.http: tcp 0
16:59:38.387569 IP bpc063.isi.deterlab.net.http > bpc036.isi.deterlab.net.59492: tcp 0
16:59:39.432528 IP bpc036.isi.deterlab.net.59494 > bpc063.isi.deterlab.net.http: tcp 0
16:59:39.432723 IP bpc063.isi.deterlab.net.http > bpc036.isi.deterlab.net.59494: tcp 0
