17:02:33.342869 IP bpc036.isi.deterlab.net.59496 > bpc063.isi.deterlab.net.http: tcp 0
17:02:33.343032 IP bpc063.isi.deterlab.net.http > bpc036.isi.deterlab.net.59496: tcp 0
17:02:34.370999 IP bpc036.isi.deterlab.net.59498 > bpc063.isi.deterlab.net.http: tcp 0
17:02:34.371117 IP bpc063.isi.deterlab.net.http > bpc036.isi.deterlab.net.59498: tcp 0
17:02:35.400246 IP bpc036.isi.deterlab.net.59500 > bpc063.isi.deterlab.net.http: tcp 0
17:02:35.400399 IP bpc063.isi.deterlab.net.http > bpc036.isi.deterlab.net.59500: tcp 0
17:02:36.429849 IP bpc036.isi.deterlab.net.59502 > bpc063.isi.deterlab.net.http: tcp 0
17:02:36.429981 IP bpc063.isi.deterlab.net.http > bpc036.isi.deterlab.net.59502: tcp 0
17:02:37.459571 IP bpc036.isi.deterlab.net.59504 > bpc063.isi.deterlab.net.http: tcp 0
17:02:37.459713 IP bpc063.isi.deterlab.net.http > bpc036.isi.deterlab.net.59504: tcp 0
17:02:38.489030 IP bpc036.isi.deterlab.net.59506 > bpc063.isi.deterlab.net.http: tcp 0
17:02:38.489145 IP bpc063.isi.deterlab.net.http > bpc036.isi.deterlab.net.59506: tcp 0
17:02:39.518452 IP bpc036.isi.deterlab.net.59508 > bpc063.isi.deterlab.net.http: tcp 0
17:02:39.518628 IP bpc063.isi.deterlab.net.http > bpc036.isi.deterlab.net.59508: tcp 0
17:02:40.547971 IP bpc036.isi.deterlab.net.59510 > bpc063.isi.deterlab.net.http: tcp 0
17:02:40.548110 IP bpc063.isi.deterlab.net.http > bpc036.isi.deterlab.net.59510: tcp 0
17:02:41.579624 IP bpc036.isi.deterlab.net.59512 > bpc063.isi.deterlab.net.http: tcp 0
17:02:41.579839 IP bpc063.isi.deterlab.net.http > bpc036.isi.deterlab.net.59512: tcp 0
17:02:42.608460 IP bpc036.isi.deterlab.net.59514 > bpc063.isi.deterlab.net.http: tcp 0
17:02:42.608621 IP bpc063.isi.deterlab.net.http > bpc036.isi.deterlab.net.59514: tcp 0
17:02:43.636580 IP bpc036.isi.deterlab.net.59516 > bpc063.isi.deterlab.net.http: tcp 0
17:02:43.636756 IP bpc063.isi.deterlab.net.http > bpc036.isi.deterlab.net.59516: tcp 0
17:02:44.664885 IP bpc036.isi.deterlab.net.59518 > bpc063.isi.deterlab.net.http: tcp 0
17:02:44.664992 IP bpc063.isi.deterlab.net.http > bpc036.isi.deterlab.net.59518: tcp 0
17:02:45.693183 IP bpc036.isi.deterlab.net.59520 > bpc063.isi.deterlab.net.http: tcp 0
17:02:45.693325 IP bpc063.isi.deterlab.net.http > bpc036.isi.deterlab.net.59520: tcp 0
17:02:46.737486 IP bpc036.isi.deterlab.net.59522 > bpc063.isi.deterlab.net.http: tcp 0
17:02:46.737592 IP bpc063.isi.deterlab.net.http > bpc036.isi.deterlab.net.59522: tcp 0
17:02:47.768012 IP bpc036.isi.deterlab.net.59524 > bpc063.isi.deterlab.net.http: tcp 0
17:02:47.768214 IP bpc063.isi.deterlab.net.http > bpc036.isi.deterlab.net.59524: tcp 0
17:02:48.799307 IP bpc036.isi.deterlab.net.59526 > bpc063.isi.deterlab.net.http: tcp 0
17:02:48.799444 IP bpc063.isi.deterlab.net.http > bpc036.isi.deterlab.net.59526: tcp 0
17:02:49.828133 IP bpc036.isi.deterlab.net.59528 > bpc063.isi.deterlab.net.http: tcp 0
17:02:49.828276 IP bpc063.isi.deterlab.net.http > bpc036.isi.deterlab.net.59528: tcp 0
17:02:50.856967 IP bpc036.isi.deterlab.net.59530 > bpc063.isi.deterlab.net.http: tcp 0
17:02:50.857111 IP bpc063.isi.deterlab.net.http > bpc036.isi.deterlab.net.59530: tcp 0
17:02:51.885862 IP bpc036.isi.deterlab.net.59532 > bpc063.isi.deterlab.net.http: tcp 0
17:02:51.886044 IP bpc063.isi.deterlab.net.http > bpc036.isi.deterlab.net.59532: tcp 0
17:02:52.914905 IP bpc036.isi.deterlab.net.59534 > bpc063.isi.deterlab.net.http: tcp 0
17:02:52.915075 IP bpc063.isi.deterlab.net.http > bpc036.isi.deterlab.net.59534: tcp 0
17:02:53.943621 IP bpc036.isi.deterlab.net.59536 > bpc063.isi.deterlab.net.http: tcp 0
17:02:53.943810 IP bpc063.isi.deterlab.net.http > bpc036.isi.deterlab.net.59536: tcp 0
17:02:54.972478 IP bpc036.isi.deterlab.net.59538 > bpc063.isi.deterlab.net.http: tcp 0
17:02:54.972593 IP bpc063.isi.deterlab.net.http > bpc036.isi.deterlab.net.59538: tcp 0
17:02:56.001480 IP bpc036.isi.deterlab.net.59540 > bpc063.isi.deterlab.net.http: tcp 0
17:02:56.001576 IP bpc063.isi.deterlab.net.http > bpc036.isi.deterlab.net.59540: tcp 0
17:02:57.030420 IP bpc036.isi.deterlab.net.59542 > bpc063.isi.deterlab.net.http: tcp 0
17:02:57.030559 IP bpc063.isi.deterlab.net.http > bpc036.isi.deterlab.net.59542: tcp 0
17:02:58.059382 IP bpc036.isi.deterlab.net.59544 > bpc063.isi.deterlab.net.http: tcp 0
17:02:58.059592 IP bpc063.isi.deterlab.net.http > bpc036.isi.deterlab.net.59544: tcp 0
17:02:59.088380 IP bpc036.isi.deterlab.net.59546 > bpc063.isi.deterlab.net.http: tcp 0
17:02:59.088476 IP bpc063.isi.deterlab.net.http > bpc036.isi.deterlab.net.59546: tcp 0
17:03:00.131501 IP bpc036.isi.deterlab.net.59548 > bpc063.isi.deterlab.net.http: tcp 0
17:03:00.131637 IP bpc063.isi.deterlab.net.http > bpc036.isi.deterlab.net.59548: tcp 0
17:03:01.162031 IP bpc036.isi.deterlab.net.59550 > bpc063.isi.deterlab.net.http: tcp 0
17:03:01.162166 IP bpc063.isi.deterlab.net.http > bpc036.isi.deterlab.net.59550: tcp 0
17:03:02.193358 IP bpc036.isi.deterlab.net.59552 > bpc063.isi.deterlab.net.http: tcp 0
17:03:02.193472 IP bpc063.isi.deterlab.net.http > bpc036.isi.deterlab.net.59552: tcp 0
17:03:03.225459 IP bpc036.isi.deterlab.net.59554 > bpc063.isi.deterlab.net.http: tcp 0
17:03:03.225550 IP bpc063.isi.deterlab.net.http > bpc036.isi.deterlab.net.59554: tcp 0
17:03:04.255950 IP bpc036.isi.deterlab.net.59556 > bpc063.isi.deterlab.net.http: tcp 0
17:03:04.256079 IP bpc063.isi.deterlab.net.http > bpc036.isi.deterlab.net.59556: tcp 0
17:03:05.286406 IP bpc036.isi.deterlab.net.59558 > bpc063.isi.deterlab.net.http: tcp 0
17:03:05.286510 IP bpc063.isi.deterlab.net.http > bpc036.isi.deterlab.net.59558: tcp 0
17:03:06.316965 IP bpc036.isi.deterlab.net.59560 > bpc063.isi.deterlab.net.http: tcp 0
17:03:06.317042 IP bpc063.isi.deterlab.net.http > bpc036.isi.deterlab.net.59560: tcp 0
17:03:07.348783 IP bpc036.isi.deterlab.net.59562 > bpc063.isi.deterlab.net.http: tcp 0
17:03:07.348892 IP bpc063.isi.deterlab.net.http > bpc036.isi.deterlab.net.59562: tcp 0
17:03:08.377252 IP bpc036.isi.deterlab.net.59564 > bpc063.isi.deterlab.net.http: tcp 0
17:03:08.377375 IP bpc063.isi.deterlab.net.http > bpc036.isi.deterlab.net.59564: tcp 0
17:03:09.408048 IP bpc036.isi.deterlab.net.59566 > bpc063.isi.deterlab.net.http: tcp 0
17:03:09.408155 IP bpc063.isi.deterlab.net.http > bpc036.isi.deterlab.net.59566: tcp 0
17:03:10.437618 IP bpc036.isi.deterlab.net.59568 > bpc063.isi.deterlab.net.http: tcp 0
17:03:10.437940 IP bpc063.isi.deterlab.net.http > bpc036.isi.deterlab.net.59568: tcp 0
17:03:11.469326 IP bpc036.isi.deterlab.net.59570 > bpc063.isi.deterlab.net.http: tcp 0
17:03:11.469407 IP bpc063.isi.deterlab.net.http > bpc036.isi.deterlab.net.59570: tcp 0
17:03:12.498205 IP bpc036.isi.deterlab.net.59572 > bpc063.isi.deterlab.net.http: tcp 0
17:03:12.498290 IP bpc063.isi.deterlab.net.http > bpc036.isi.deterlab.net.59572: tcp 0
17:03:13.526884 IP bpc036.isi.deterlab.net.59574 > bpc063.isi.deterlab.net.http: tcp 0
17:03:13.526974 IP bpc063.isi.deterlab.net.http > bpc036.isi.deterlab.net.59574: tcp 0
17:03:14.555594 IP bpc036.isi.deterlab.net.59576 > bpc063.isi.deterlab.net.http: tcp 0
17:03:14.555661 IP bpc063.isi.deterlab.net.http > bpc036.isi.deterlab.net.59576: tcp 0
17:03:15.584115 IP bpc036.isi.deterlab.net.59578 > bpc063.isi.deterlab.net.http: tcp 0
17:03:15.584242 IP bpc063.isi.deterlab.net.http > bpc036.isi.deterlab.net.59578: tcp 0
17:03:16.615299 IP bpc036.isi.deterlab.net.59580 > bpc063.isi.deterlab.net.http: tcp 0
17:03:16.615378 IP bpc063.isi.deterlab.net.http > bpc036.isi.deterlab.net.59580: tcp 0
17:03:17.643862 IP bpc036.isi.deterlab.net.59582 > bpc063.isi.deterlab.net.http: tcp 0
17:03:17.643947 IP bpc063.isi.deterlab.net.http > bpc036.isi.deterlab.net.59582: tcp 0
17:03:18.673952 IP bpc036.isi.deterlab.net.59584 > bpc063.isi.deterlab.net.http: tcp 0
17:03:18.674079 IP bpc063.isi.deterlab.net.http > bpc036.isi.deterlab.net.59584: tcp 0
17:03:19.702628 IP bpc036.isi.deterlab.net.59586 > bpc063.isi.deterlab.net.http: tcp 0
17:03:19.702762 IP bpc063.isi.deterlab.net.http > bpc036.isi.deterlab.net.59586: tcp 0
17:03:20.731608 IP bpc036.isi.deterlab.net.59588 > bpc063.isi.deterlab.net.http: tcp 0
17:03:20.731698 IP bpc063.isi.deterlab.net.http > bpc036.isi.deterlab.net.59588: tcp 0
17:03:21.762340 IP bpc036.isi.deterlab.net.59590 > bpc063.isi.deterlab.net.http: tcp 0
17:03:21.762435 IP bpc063.isi.deterlab.net.http > bpc036.isi.deterlab.net.59590: tcp 0
17:03:22.795160 IP bpc036.isi.deterlab.net.59592 > bpc063.isi.deterlab.net.http: tcp 0
17:03:22.795261 IP bpc063.isi.deterlab.net.http > bpc036.isi.deterlab.net.59592: tcp 0
17:03:23.826574 IP bpc036.isi.deterlab.net.59594 > bpc063.isi.deterlab.net.http: tcp 0
17:03:23.826691 IP bpc063.isi.deterlab.net.http > bpc036.isi.deterlab.net.59594: tcp 0
17:03:24.855996 IP bpc036.isi.deterlab.net.59596 > bpc063.isi.deterlab.net.http: tcp 0
17:03:24.856124 IP bpc063.isi.deterlab.net.http > bpc036.isi.deterlab.net.59596: tcp 0
17:03:25.885464 IP bpc036.isi.deterlab.net.59598 > bpc063.isi.deterlab.net.http: tcp 0
17:03:25.885557 IP bpc063.isi.deterlab.net.http > bpc036.isi.deterlab.net.59598: tcp 0
17:03:26.915041 IP bpc036.isi.deterlab.net.59600 > bpc063.isi.deterlab.net.http: tcp 0
17:03:26.915139 IP bpc063.isi.deterlab.net.http > bpc036.isi.deterlab.net.59600: tcp 0
17:03:27.943934 IP bpc036.isi.deterlab.net.59602 > bpc063.isi.deterlab.net.http: tcp 0
17:03:27.944071 IP bpc063.isi.deterlab.net.http > bpc036.isi.deterlab.net.59602: tcp 0
17:03:28.974556 IP bpc036.isi.deterlab.net.59604 > bpc063.isi.deterlab.net.http: tcp 0
17:03:28.974662 IP bpc063.isi.deterlab.net.http > bpc036.isi.deterlab.net.59604: tcp 0
17:03:30.003388 IP bpc036.isi.deterlab.net.59606 > bpc063.isi.deterlab.net.http: tcp 0
17:03:30.003490 IP bpc063.isi.deterlab.net.http > bpc036.isi.deterlab.net.59606: tcp 0
17:03:31.032071 IP bpc036.isi.deterlab.net.59608 > bpc063.isi.deterlab.net.http: tcp 0
17:03:31.032174 IP bpc063.isi.deterlab.net.http > bpc036.isi.deterlab.net.59608: tcp 0
17:03:32.060957 IP bpc036.isi.deterlab.net.59610 > bpc063.isi.deterlab.net.http: tcp 0
17:03:32.061058 IP bpc063.isi.deterlab.net.http > bpc036.isi.deterlab.net.59610: tcp 0
17:03:33.089852 IP bpc036.isi.deterlab.net.59612 > bpc063.isi.deterlab.net.http: tcp 0
17:03:33.089942 IP bpc063.isi.deterlab.net.http > bpc036.isi.deterlab.net.59612: tcp 0
17:03:34.118575 IP bpc036.isi.deterlab.net.59614 > bpc063.isi.deterlab.net.http: tcp 0
17:03:34.118675 IP bpc063.isi.deterlab.net.http > bpc036.isi.deterlab.net.59614: tcp 0
17:03:35.147519 IP bpc036.isi.deterlab.net.59616 > bpc063.isi.deterlab.net.http: tcp 0
17:03:35.147608 IP bpc063.isi.deterlab.net.http > bpc036.isi.deterlab.net.59616: tcp 0
17:03:36.176466 IP bpc036.isi.deterlab.net.59618 > bpc063.isi.deterlab.net.http: tcp 0
17:03:36.176543 IP bpc063.isi.deterlab.net.http > bpc036.isi.deterlab.net.59618: tcp 0
17:03:37.205939 IP bpc036.isi.deterlab.net.59620 > bpc063.isi.deterlab.net.http: tcp 0
17:03:37.206030 IP bpc063.isi.deterlab.net.http > bpc036.isi.deterlab.net.59620: tcp 0
17:03:38.236695 IP bpc036.isi.deterlab.net.59622 > bpc063.isi.deterlab.net.http: tcp 0
17:03:38.236766 IP bpc063.isi.deterlab.net.http > bpc036.isi.deterlab.net.59622: tcp 0
17:03:39.265603 IP bpc036.isi.deterlab.net.59624 > bpc063.isi.deterlab.net.http: tcp 0
17:03:39.265696 IP bpc063.isi.deterlab.net.http > bpc036.isi.deterlab.net.59624: tcp 0
17:03:40.294606 IP bpc036.isi.deterlab.net.59626 > bpc063.isi.deterlab.net.http: tcp 0
17:03:40.294730 IP bpc063.isi.deterlab.net.http > bpc036.isi.deterlab.net.59626: tcp 0
17:03:41.323365 IP bpc036.isi.deterlab.net.59628 > bpc063.isi.deterlab.net.http: tcp 0
17:03:41.323463 IP bpc063.isi.deterlab.net.http > bpc036.isi.deterlab.net.59628: tcp 0
17:03:42.352342 IP bpc036.isi.deterlab.net.59630 > bpc063.isi.deterlab.net.http: tcp 0
17:03:42.352447 IP bpc063.isi.deterlab.net.http > bpc036.isi.deterlab.net.59630: tcp 0
17:03:43.380964 IP bpc036.isi.deterlab.net.59632 > bpc063.isi.deterlab.net.http: tcp 0
17:03:43.381036 IP bpc063.isi.deterlab.net.http > bpc036.isi.deterlab.net.59632: tcp 0
17:03:44.410165 IP bpc036.isi.deterlab.net.59634 > bpc063.isi.deterlab.net.http: tcp 0
17:03:44.410264 IP bpc063.isi.deterlab.net.http > bpc036.isi.deterlab.net.59634: tcp 0
17:03:45.440558 IP bpc036.isi.deterlab.net.59636 > bpc063.isi.deterlab.net.http: tcp 0
17:03:45.440645 IP bpc063.isi.deterlab.net.http > bpc036.isi.deterlab.net.59636: tcp 0
17:03:46.469073 IP bpc036.isi.deterlab.net.59638 > bpc063.isi.deterlab.net.http: tcp 0
17:03:46.469179 IP bpc063.isi.deterlab.net.http > bpc036.isi.deterlab.net.59638: tcp 0
17:03:47.513966 IP bpc036.isi.deterlab.net.59640 > bpc063.isi.deterlab.net.http: tcp 0
17:03:47.514088 IP bpc063.isi.deterlab.net.http > bpc036.isi.deterlab.net.59640: tcp 0
17:03:48.542385 IP bpc036.isi.deterlab.net.59642 > bpc063.isi.deterlab.net.http: tcp 0
17:03:48.542471 IP bpc063.isi.deterlab.net.http > bpc036.isi.deterlab.net.59642: tcp 0
17:03:49.586744 IP bpc036.isi.deterlab.net.59644 > bpc063.isi.deterlab.net.http: tcp 0
17:03:49.586881 IP bpc063.isi.deterlab.net.http > bpc036.isi.deterlab.net.59644: tcp 0
17:03:50.632461 IP bpc036.isi.deterlab.net.59646 > bpc063.isi.deterlab.net.http: tcp 0
17:03:50.632589 IP bpc063.isi.deterlab.net.http > bpc036.isi.deterlab.net.59646: tcp 0
17:03:51.663091 IP bpc036.isi.deterlab.net.59648 > bpc063.isi.deterlab.net.http: tcp 0
17:03:51.663219 IP bpc063.isi.deterlab.net.http > bpc036.isi.deterlab.net.59648: tcp 0
17:03:52.692095 IP bpc036.isi.deterlab.net.59650 > bpc063.isi.deterlab.net.http: tcp 0
17:03:52.692201 IP bpc063.isi.deterlab.net.http > bpc036.isi.deterlab.net.59650: tcp 0
17:03:53.721414 IP bpc036.isi.deterlab.net.59652 > bpc063.isi.deterlab.net.http: tcp 0
17:03:53.721488 IP bpc063.isi.deterlab.net.http > bpc036.isi.deterlab.net.59652: tcp 0
17:03:54.750694 IP bpc036.isi.deterlab.net.59654 > bpc063.isi.deterlab.net.http: tcp 0
17:03:54.750817 IP bpc063.isi.deterlab.net.http > bpc036.isi.deterlab.net.59654: tcp 0
17:03:55.781218 IP bpc036.isi.deterlab.net.59656 > bpc063.isi.deterlab.net.http: tcp 0
17:03:55.781300 IP bpc063.isi.deterlab.net.http > bpc036.isi.deterlab.net.59656: tcp 0
17:03:56.812536 IP bpc036.isi.deterlab.net.59658 > bpc063.isi.deterlab.net.http: tcp 0
17:03:56.812679 IP bpc063.isi.deterlab.net.http > bpc036.isi.deterlab.net.59658: tcp 0
17:03:57.841121 IP bpc036.isi.deterlab.net.59660 > bpc063.isi.deterlab.net.http: tcp 0
17:03:57.841214 IP bpc063.isi.deterlab.net.http > bpc036.isi.deterlab.net.59660: tcp 0
17:03:58.870744 IP bpc036.isi.deterlab.net.59662 > bpc063.isi.deterlab.net.http: tcp 0
17:03:58.870896 IP bpc063.isi.deterlab.net.http > bpc036.isi.deterlab.net.59662: tcp 0
17:03:59.901048 IP bpc036.isi.deterlab.net.59664 > bpc063.isi.deterlab.net.http: tcp 0
17:03:59.901127 IP bpc063.isi.deterlab.net.http > bpc036.isi.deterlab.net.59664: tcp 0
17:04:00.943498 IP bpc036.isi.deterlab.net.59666 > bpc063.isi.deterlab.net.http: tcp 0
17:04:00.943602 IP bpc063.isi.deterlab.net.http > bpc036.isi.deterlab.net.59666: tcp 0
17:04:01.974939 IP bpc036.isi.deterlab.net.59668 > bpc063.isi.deterlab.net.http: tcp 0
17:04:01.975082 IP bpc063.isi.deterlab.net.http > bpc036.isi.deterlab.net.59668: tcp 0
17:04:03.019736 IP bpc036.isi.deterlab.net.59670 > bpc063.isi.deterlab.net.http: tcp 0
17:04:03.019840 IP bpc063.isi.deterlab.net.http > bpc036.isi.deterlab.net.59670: tcp 0
17:04:04.048965 IP bpc036.isi.deterlab.net.59672 > bpc063.isi.deterlab.net.http: tcp 0
17:04:04.049028 IP bpc063.isi.deterlab.net.http > bpc036.isi.deterlab.net.59672: tcp 0
17:04:05.077491 IP bpc036.isi.deterlab.net.59674 > bpc063.isi.deterlab.net.http: tcp 0
17:04:05.077560 IP bpc063.isi.deterlab.net.http > bpc036.isi.deterlab.net.59674: tcp 0
17:04:06.122350 IP bpc036.isi.deterlab.net.59676 > bpc063.isi.deterlab.net.http: tcp 0
17:04:06.122465 IP bpc063.isi.deterlab.net.http > bpc036.isi.deterlab.net.59676: tcp 0
17:04:07.151565 IP bpc036.isi.deterlab.net.59678 > bpc063.isi.deterlab.net.http: tcp 0
17:04:07.151698 IP bpc063.isi.deterlab.net.http > bpc036.isi.deterlab.net.59678: tcp 0
17:04:08.180967 IP bpc036.isi.deterlab.net.59680 > bpc063.isi.deterlab.net.http: tcp 0
17:04:08.181114 IP bpc063.isi.deterlab.net.http > bpc036.isi.deterlab.net.59680: tcp 0
17:04:09.210787 IP bpc036.isi.deterlab.net.59682 > bpc063.isi.deterlab.net.http: tcp 0
17:04:09.210894 IP bpc063.isi.deterlab.net.http > bpc036.isi.deterlab.net.59682: tcp 0
17:04:10.239795 IP bpc036.isi.deterlab.net.59684 > bpc063.isi.deterlab.net.http: tcp 0
17:04:10.239928 IP bpc063.isi.deterlab.net.http > bpc036.isi.deterlab.net.59684: tcp 0
17:04:11.268510 IP bpc036.isi.deterlab.net.59686 > bpc063.isi.deterlab.net.http: tcp 0
17:04:11.268613 IP bpc063.isi.deterlab.net.http > bpc036.isi.deterlab.net.59686: tcp 0
17:04:12.313446 IP bpc036.isi.deterlab.net.59688 > bpc063.isi.deterlab.net.http: tcp 0
17:04:12.313697 IP bpc063.isi.deterlab.net.http > bpc036.isi.deterlab.net.59688: tcp 0
17:04:13.342521 IP bpc036.isi.deterlab.net.59690 > bpc063.isi.deterlab.net.http: tcp 0
17:04:13.342601 IP bpc063.isi.deterlab.net.http > bpc036.isi.deterlab.net.59690: tcp 0
17:04:14.371388 IP bpc036.isi.deterlab.net.59692 > bpc063.isi.deterlab.net.http: tcp 0
17:04:14.371485 IP bpc063.isi.deterlab.net.http > bpc036.isi.deterlab.net.59692: tcp 0
17:04:15.401039 IP bpc036.isi.deterlab.net.59694 > bpc063.isi.deterlab.net.http: tcp 0
17:04:15.401169 IP bpc063.isi.deterlab.net.http > bpc036.isi.deterlab.net.59694: tcp 0
17:04:16.430231 IP bpc036.isi.deterlab.net.59696 > bpc063.isi.deterlab.net.http: tcp 0
17:04:16.430352 IP bpc063.isi.deterlab.net.http > bpc036.isi.deterlab.net.59696: tcp 0
17:04:17.460385 IP bpc036.isi.deterlab.net.59698 > bpc063.isi.deterlab.net.http: tcp 0
17:04:17.460490 IP bpc063.isi.deterlab.net.http > bpc036.isi.deterlab.net.59698: tcp 0
17:04:18.490521 IP bpc036.isi.deterlab.net.59700 > bpc063.isi.deterlab.net.http: tcp 0
17:04:18.490609 IP bpc063.isi.deterlab.net.http > bpc036.isi.deterlab.net.59700: tcp 0
17:04:19.519275 IP bpc036.isi.deterlab.net.59702 > bpc063.isi.deterlab.net.http: tcp 0
17:04:19.519345 IP bpc063.isi.deterlab.net.http > bpc036.isi.deterlab.net.59702: tcp 0
17:04:20.551349 IP bpc036.isi.deterlab.net.59704 > bpc063.isi.deterlab.net.http: tcp 0
17:04:20.551470 IP bpc063.isi.deterlab.net.http > bpc036.isi.deterlab.net.59704: tcp 0
17:04:21.580451 IP bpc036.isi.deterlab.net.59706 > bpc063.isi.deterlab.net.http: tcp 0
17:04:21.580603 IP bpc063.isi.deterlab.net.http > bpc036.isi.deterlab.net.59706: tcp 0
17:04:22.609618 IP bpc036.isi.deterlab.net.59708 > bpc063.isi.deterlab.net.http: tcp 0
17:04:22.609737 IP bpc063.isi.deterlab.net.http > bpc036.isi.deterlab.net.59708: tcp 0
17:04:23.639116 IP bpc036.isi.deterlab.net.59710 > bpc063.isi.deterlab.net.http: tcp 0
17:04:23.639219 IP bpc063.isi.deterlab.net.http > bpc036.isi.deterlab.net.59710: tcp 0
17:04:24.668596 IP bpc036.isi.deterlab.net.59712 > bpc063.isi.deterlab.net.http: tcp 0
17:04:24.668702 IP bpc063.isi.deterlab.net.http > bpc036.isi.deterlab.net.59712: tcp 0
17:04:25.697313 IP bpc036.isi.deterlab.net.59714 > bpc063.isi.deterlab.net.http: tcp 0
17:04:25.697391 IP bpc063.isi.deterlab.net.http > bpc036.isi.deterlab.net.59714: tcp 0
17:04:26.742164 IP bpc036.isi.deterlab.net.59716 > bpc063.isi.deterlab.net.http: tcp 0
17:04:26.742301 IP bpc063.isi.deterlab.net.http > bpc036.isi.deterlab.net.59716: tcp 0
17:04:27.771346 IP bpc036.isi.deterlab.net.59718 > bpc063.isi.deterlab.net.http: tcp 0
17:04:27.771479 IP bpc063.isi.deterlab.net.http > bpc036.isi.deterlab.net.59718: tcp 0
17:04:28.801168 IP bpc036.isi.deterlab.net.59720 > bpc063.isi.deterlab.net.http: tcp 0
17:04:28.801261 IP bpc063.isi.deterlab.net.http > bpc036.isi.deterlab.net.59720: tcp 0
17:04:29.829623 IP bpc036.isi.deterlab.net.59722 > bpc063.isi.deterlab.net.http: tcp 0
17:04:29.829746 IP bpc063.isi.deterlab.net.http > bpc036.isi.deterlab.net.59722: tcp 0
17:04:30.874080 IP bpc036.isi.deterlab.net.59724 > bpc063.isi.deterlab.net.http: tcp 0
17:04:30.874160 IP bpc063.isi.deterlab.net.http > bpc036.isi.deterlab.net.59724: tcp 0
17:04:31.903883 IP bpc036.isi.deterlab.net.59726 > bpc063.isi.deterlab.net.http: tcp 0
17:04:31.903988 IP bpc063.isi.deterlab.net.http > bpc036.isi.deterlab.net.59726: tcp 0
17:04:32.950094 IP bpc036.isi.deterlab.net.59728 > bpc063.isi.deterlab.net.http: tcp 0
17:04:32.950195 IP bpc063.isi.deterlab.net.http > bpc036.isi.deterlab.net.59728: tcp 0
17:04:33.978985 IP bpc036.isi.deterlab.net.59730 > bpc063.isi.deterlab.net.http: tcp 0
17:04:33.979128 IP bpc063.isi.deterlab.net.http > bpc036.isi.deterlab.net.59730: tcp 0
17:04:35.023903 IP bpc036.isi.deterlab.net.59732 > bpc063.isi.deterlab.net.http: tcp 0
17:04:35.024036 IP bpc063.isi.deterlab.net.http > bpc036.isi.deterlab.net.59732: tcp 0
17:04:36.052255 IP bpc036.isi.deterlab.net.59734 > bpc063.isi.deterlab.net.http: tcp 0
17:04:36.052371 IP bpc063.isi.deterlab.net.http > bpc036.isi.deterlab.net.59734: tcp 0
17:04:37.082251 IP bpc036.isi.deterlab.net.59736 > bpc063.isi.deterlab.net.http: tcp 0
17:04:37.082353 IP bpc063.isi.deterlab.net.http > bpc036.isi.deterlab.net.59736: tcp 0
17:04:38.112430 IP bpc036.isi.deterlab.net.59738 > bpc063.isi.deterlab.net.http: tcp 0
17:04:38.112535 IP bpc063.isi.deterlab.net.http > bpc036.isi.deterlab.net.59738: tcp 0
17:04:39.141998 IP bpc036.isi.deterlab.net.59740 > bpc063.isi.deterlab.net.http: tcp 0
17:04:39.142071 IP bpc063.isi.deterlab.net.http > bpc036.isi.deterlab.net.59740: tcp 0
17:04:40.186723 IP bpc036.isi.deterlab.net.59742 > bpc063.isi.deterlab.net.http: tcp 0
17:04:40.186827 IP bpc063.isi.deterlab.net.http > bpc036.isi.deterlab.net.59742: tcp 0
17:04:41.217247 IP bpc036.isi.deterlab.net.59744 > bpc063.isi.deterlab.net.http: tcp 0
17:04:41.217314 IP bpc063.isi.deterlab.net.http > bpc036.isi.deterlab.net.59744: tcp 0
17:04:42.246407 IP bpc036.isi.deterlab.net.59746 > bpc063.isi.deterlab.net.http: tcp 0
17:04:42.246495 IP bpc063.isi.deterlab.net.http > bpc036.isi.deterlab.net.59746: tcp 0
17:04:43.274865 IP bpc036.isi.deterlab.net.59748 > bpc063.isi.deterlab.net.http: tcp 0
17:04:43.274951 IP bpc063.isi.deterlab.net.http > bpc036.isi.deterlab.net.59748: tcp 0
17:04:44.319396 IP bpc036.isi.deterlab.net.59750 > bpc063.isi.deterlab.net.http: tcp 0
17:04:44.319510 IP bpc063.isi.deterlab.net.http > bpc036.isi.deterlab.net.59750: tcp 0
17:04:45.347640 IP bpc036.isi.deterlab.net.59752 > bpc063.isi.deterlab.net.http: tcp 0
17:04:45.347745 IP bpc063.isi.deterlab.net.http > bpc036.isi.deterlab.net.59752: tcp 0
17:04:46.376460 IP bpc036.isi.deterlab.net.59754 > bpc063.isi.deterlab.net.http: tcp 0
17:04:46.376532 IP bpc063.isi.deterlab.net.http > bpc036.isi.deterlab.net.59754: tcp 0
17:04:47.406942 IP bpc036.isi.deterlab.net.59756 > bpc063.isi.deterlab.net.http: tcp 0
17:04:47.407047 IP bpc063.isi.deterlab.net.http > bpc036.isi.deterlab.net.59756: tcp 0
17:04:48.437280 IP bpc036.isi.deterlab.net.59758 > bpc063.isi.deterlab.net.http: tcp 0
17:04:48.437362 IP bpc063.isi.deterlab.net.http > bpc036.isi.deterlab.net.59758: tcp 0
17:04:49.465777 IP bpc036.isi.deterlab.net.59760 > bpc063.isi.deterlab.net.http: tcp 0
17:04:49.465852 IP bpc063.isi.deterlab.net.http > bpc036.isi.deterlab.net.59760: tcp 0
17:04:50.495608 IP bpc036.isi.deterlab.net.59762 > bpc063.isi.deterlab.net.http: tcp 0
17:04:50.495683 IP bpc063.isi.deterlab.net.http > bpc036.isi.deterlab.net.59762: tcp 0
17:04:51.525173 IP bpc036.isi.deterlab.net.59764 > bpc063.isi.deterlab.net.http: tcp 0
17:04:51.525263 IP bpc063.isi.deterlab.net.http > bpc036.isi.deterlab.net.59764: tcp 0
17:04:52.556929 IP bpc036.isi.deterlab.net.59766 > bpc063.isi.deterlab.net.http: tcp 0
17:04:52.556994 IP bpc063.isi.deterlab.net.http > bpc036.isi.deterlab.net.59766: tcp 0
17:04:53.602583 IP bpc036.isi.deterlab.net.59768 > bpc063.isi.deterlab.net.http: tcp 0
17:04:53.602697 IP bpc063.isi.deterlab.net.http > bpc036.isi.deterlab.net.59768: tcp 0
17:04:54.646922 IP bpc036.isi.deterlab.net.59770 > bpc063.isi.deterlab.net.http: tcp 0
17:04:54.647057 IP bpc063.isi.deterlab.net.http > bpc036.isi.deterlab.net.59770: tcp 0
17:04:55.675220 IP bpc036.isi.deterlab.net.59772 > bpc063.isi.deterlab.net.http: tcp 0
17:04:55.675341 IP bpc063.isi.deterlab.net.http > bpc036.isi.deterlab.net.59772: tcp 0
17:04:56.703387 IP bpc036.isi.deterlab.net.59774 > bpc063.isi.deterlab.net.http: tcp 0
17:04:56.703477 IP bpc063.isi.deterlab.net.http > bpc036.isi.deterlab.net.59774: tcp 0
17:04:57.731579 IP bpc036.isi.deterlab.net.59776 > bpc063.isi.deterlab.net.http: tcp 0
17:04:57.731716 IP bpc063.isi.deterlab.net.http > bpc036.isi.deterlab.net.59776: tcp 0
17:04:58.760649 IP bpc036.isi.deterlab.net.59778 > bpc063.isi.deterlab.net.http: tcp 0
17:04:58.760746 IP bpc063.isi.deterlab.net.http > bpc036.isi.deterlab.net.59778: tcp 0
17:04:59.789468 IP bpc036.isi.deterlab.net.59780 > bpc063.isi.deterlab.net.http: tcp 0
17:04:59.789581 IP bpc063.isi.deterlab.net.http > bpc036.isi.deterlab.net.59780: tcp 0
17:05:00.833655 IP bpc036.isi.deterlab.net.59782 > bpc063.isi.deterlab.net.http: tcp 0
17:05:00.833790 IP bpc063.isi.deterlab.net.http > bpc036.isi.deterlab.net.59782: tcp 0
17:05:01.877562 IP bpc036.isi.deterlab.net.59784 > bpc063.isi.deterlab.net.http: tcp 0
17:05:01.877652 IP bpc063.isi.deterlab.net.http > bpc036.isi.deterlab.net.59784: tcp 0
17:05:02.906172 IP bpc036.isi.deterlab.net.59786 > bpc063.isi.deterlab.net.http: tcp 0
17:05:02.906238 IP bpc063.isi.deterlab.net.http > bpc036.isi.deterlab.net.59786: tcp 0
17:05:03.935091 IP bpc036.isi.deterlab.net.59788 > bpc063.isi.deterlab.net.http: tcp 0
17:05:03.935269 IP bpc063.isi.deterlab.net.http > bpc036.isi.deterlab.net.59788: tcp 0
17:05:04.979354 IP bpc036.isi.deterlab.net.59790 > bpc063.isi.deterlab.net.http: tcp 0
17:05:04.979480 IP bpc063.isi.deterlab.net.http > bpc036.isi.deterlab.net.59790: tcp 0
17:05:06.024786 IP bpc036.isi.deterlab.net.59792 > bpc063.isi.deterlab.net.http: tcp 0
17:05:06.024938 IP bpc063.isi.deterlab.net.http > bpc036.isi.deterlab.net.59792: tcp 0
17:05:07.069561 IP bpc036.isi.deterlab.net.59794 > bpc063.isi.deterlab.net.http: tcp 0
17:05:07.069696 IP bpc063.isi.deterlab.net.http > bpc036.isi.deterlab.net.59794: tcp 0
17:05:08.115210 IP bpc036.isi.deterlab.net.59796 > bpc063.isi.deterlab.net.http: tcp 0
17:05:08.115303 IP bpc063.isi.deterlab.net.http > bpc036.isi.deterlab.net.59796: tcp 0
17:05:09.159351 IP bpc036.isi.deterlab.net.59798 > bpc063.isi.deterlab.net.http: tcp 0
17:05:09.159462 IP bpc063.isi.deterlab.net.http > bpc036.isi.deterlab.net.59798: tcp 0
17:05:10.204943 IP bpc036.isi.deterlab.net.59800 > bpc063.isi.deterlab.net.http: tcp 0
17:05:10.205070 IP bpc063.isi.deterlab.net.http > bpc036.isi.deterlab.net.59800: tcp 0
17:05:11.249153 IP bpc036.isi.deterlab.net.59802 > bpc063.isi.deterlab.net.http: tcp 0
17:05:11.249279 IP bpc063.isi.deterlab.net.http > bpc036.isi.deterlab.net.59802: tcp 0
17:05:12.279349 IP bpc036.isi.deterlab.net.59804 > bpc063.isi.deterlab.net.http: tcp 0
17:05:12.279511 IP bpc063.isi.deterlab.net.http > bpc036.isi.deterlab.net.59804: tcp 0
17:05:13.325648 IP bpc036.isi.deterlab.net.59806 > bpc063.isi.deterlab.net.http: tcp 0
17:05:13.325721 IP bpc063.isi.deterlab.net.http > bpc036.isi.deterlab.net.59806: tcp 0
17:05:14.369979 IP bpc036.isi.deterlab.net.59808 > bpc063.isi.deterlab.net.http: tcp 0
17:05:14.370177 IP bpc063.isi.deterlab.net.http > bpc036.isi.deterlab.net.59808: tcp 0
17:05:15.398197 IP bpc036.isi.deterlab.net.59810 > bpc063.isi.deterlab.net.http: tcp 0
17:05:15.398312 IP bpc063.isi.deterlab.net.http > bpc036.isi.deterlab.net.59810: tcp 0
17:05:16.426403 IP bpc036.isi.deterlab.net.59812 > bpc063.isi.deterlab.net.http: tcp 0
17:05:16.426498 IP bpc063.isi.deterlab.net.http > bpc036.isi.deterlab.net.59812: tcp 0
17:05:17.460124 IP bpc036.isi.deterlab.net.59814 > bpc063.isi.deterlab.net.http: tcp 0
17:05:17.460220 IP bpc063.isi.deterlab.net.http > bpc036.isi.deterlab.net.59814: tcp 0
17:05:18.490273 IP bpc036.isi.deterlab.net.59816 > bpc063.isi.deterlab.net.http: tcp 0
17:05:18.490391 IP bpc063.isi.deterlab.net.http > bpc036.isi.deterlab.net.59816: tcp 0
17:05:19.519691 IP bpc036.isi.deterlab.net.59818 > bpc063.isi.deterlab.net.http: tcp 0
17:05:19.519875 IP bpc063.isi.deterlab.net.http > bpc036.isi.deterlab.net.59818: tcp 0
17:05:20.549712 IP bpc036.isi.deterlab.net.59820 > bpc063.isi.deterlab.net.http: tcp 0
17:05:20.549908 IP bpc063.isi.deterlab.net.http > bpc036.isi.deterlab.net.59820: tcp 0
17:05:21.594114 IP bpc036.isi.deterlab.net.59822 > bpc063.isi.deterlab.net.http: tcp 0
17:05:21.594217 IP bpc063.isi.deterlab.net.http > bpc036.isi.deterlab.net.59822: tcp 0
17:05:22.640255 IP bpc036.isi.deterlab.net.59824 > bpc063.isi.deterlab.net.http: tcp 0
17:05:22.640425 IP bpc063.isi.deterlab.net.http > bpc036.isi.deterlab.net.59824: tcp 0
17:05:23.669785 IP bpc036.isi.deterlab.net.59826 > bpc063.isi.deterlab.net.http: tcp 0
17:05:23.669960 IP bpc063.isi.deterlab.net.http > bpc036.isi.deterlab.net.59826: tcp 0
17:05:24.698151 IP bpc036.isi.deterlab.net.59828 > bpc063.isi.deterlab.net.http: tcp 0
17:05:24.698245 IP bpc063.isi.deterlab.net.http > bpc036.isi.deterlab.net.59828: tcp 0
17:05:25.727065 IP bpc036.isi.deterlab.net.59830 > bpc063.isi.deterlab.net.http: tcp 0
17:05:25.727179 IP bpc063.isi.deterlab.net.http > bpc036.isi.deterlab.net.59830: tcp 0
17:05:26.771636 IP bpc036.isi.deterlab.net.59832 > bpc063.isi.deterlab.net.http: tcp 0
17:05:26.771789 IP bpc063.isi.deterlab.net.http > bpc036.isi.deterlab.net.59832: tcp 0
17:05:27.817519 IP bpc036.isi.deterlab.net.59834 > bpc063.isi.deterlab.net.http: tcp 0
17:05:27.817646 IP bpc063.isi.deterlab.net.http > bpc036.isi.deterlab.net.59834: tcp 0
17:05:28.863055 IP bpc036.isi.deterlab.net.59836 > bpc063.isi.deterlab.net.http: tcp 0
17:05:28.863203 IP bpc063.isi.deterlab.net.http > bpc036.isi.deterlab.net.59836: tcp 0
17:05:29.907373 IP bpc036.isi.deterlab.net.59838 > bpc063.isi.deterlab.net.http: tcp 0
17:05:29.907513 IP bpc063.isi.deterlab.net.http > bpc036.isi.deterlab.net.59838: tcp 0
17:05:30.935397 IP bpc036.isi.deterlab.net.59840 > bpc063.isi.deterlab.net.http: tcp 0
17:05:30.935547 IP bpc063.isi.deterlab.net.http > bpc036.isi.deterlab.net.59840: tcp 0
17:05:31.979773 IP bpc036.isi.deterlab.net.59842 > bpc063.isi.deterlab.net.http: tcp 0
17:05:31.979957 IP bpc063.isi.deterlab.net.http > bpc036.isi.deterlab.net.59842: tcp 0
